	Unnamed: 0	Unnamed: 0.1	Unnamed: 0.1.1	Unnamed: 0.1.1.1	Unnamed: 0.1.1.1.1	Unnamed: 0.1.1.1.1.1	Unnamed: 0.1.1.1.1.1.1	compare	prefix	input_text	target_text	input_text_fa	target_text_fa	pred_text1	pred_text2	preds_score	pred1_score	pred2_score	bookmark
23942	23942	23942	23942	26135	26135	26135	28685	//	xIntent	PersonX looks all over town	to find something	PersonX به سراسر شهر نگاه می کند	پیدا کردن چیزی	to find something	to be noticed	0.448	1.0	0.448	False
23943	23943	23943	23943	23813	23813	23813	26363	//	xIntent	PersonX looks amazing	to impress others	PersonX شگفت آور به نظر می رسد	برای تحت تأثیر قرار دادن دیگران	to impress others	to be noticed	0.6189	1.0	0.6189	False
23970	23969	23970	23969	42659	42659	42659	5207	//	xIntent	PersonX looks at PersonY with a smile	to be friendly	PersonX با لبخند به PersonY نگاه می کند	دوستانه بودن	to be friendly	to express their emotions	0.3537	1.0	0.3537	False
24065	24065	24065	24065	23495	23495	23495	26045	//	xIntent	PersonX looks great	to be admired	PersonX عالی به نظر می رسد	مورد تحسین قرار گرفتن	to be admired	to be noticed	0.6605	1.0	0.6605	False
24080	24080	24080	24080	37354	37354	37354	19903	//	xIntent	PersonX looks in PersonY's closet	to find something	PersonX در کمد PersonY نگاه می کند	پیدا کردن چیزی	to find something	to be friendly	0.36	1.0	0.36	False
24121	24121	24121	24121	1775	1775	1775	41775	//	xIntent	PersonX looks perfect	to look nice	PersonX عالی به نظر می رسد	خوب به نظر رسیدن	to look nice	to be noticed	0.4234	1.0	0.4234	False
24125	24125	24125	24125	29025	29025	29025	11574	//	xIntent	PersonX looks pretty good	to look good	PersonX بسیار خوب به نظر می رسد	خوب به نظر رسیدن	to look good	to be cautious	0.3973	1.0	0.3973	False
24128	24129	24126	24130	0	0	0	40000	//	xIntent	PersonX looks really cool	to be approved of	PersonX واقعا عالی به نظر می رسد	تصویب شود	to be approved of	to be a good friend	0.1007	1.0	0.1007	False
24129	24126	24130	24127	17449	17449	17449	40000	//	xIntent	PersonX looks really cool	to be approved of	PersonX واقعا عالی به نظر می رسد	تصویب شود	to be approved of	to be a good friend	0.1007	1.0	0.1007	False
24144	24144	24144	24144	44673	44673	44673	7221	//	xIntent	PersonX looks round the room	to find something	PersonX دور اتاق را نگاه می کند	پیدا کردن چیزی	to find something	to ignore someone	0.2692	1.0	0.2692	False
24149	24149	24149	24149	9200	9200	9200	31751	//	xIntent	PersonX looks silly	to make everyone laugh	PersonX احمقانه به نظر می رسد	برای خنداندن همه	to make everyone laugh	to avoid a confrontation	0.167	1.0	0.167	False
24151	24151	24151	24151	10796	10796	10796	33347	//	xIntent	PersonX looks so good	to look good	PersonX خیلی خوب به نظر می رسد	خوب به نظر رسیدن	to look good	to be cautious	0.3973	1.0	0.3973	False
24154	24154	24154	24154	17438	17438	17438	39989	//	xIntent	PersonX looks straight at PersonY	to be assertive	PersonX مستقیماً به PersonY نگاه می کند	قاطع بودن	to be assertive	to focus on persony	0.3524	1.0	0.3524	False
24169	24169	24169	24169	32240	32240	32240	14789	//	xIntent	PersonX loosens the purse strings	to save money	PersonX رشته های کیف پول را شل می کند	برای صرفه جویی در پول	to save money	to steal	0.4958	1.0	0.4958	False
24173	24173	24173	24173	19703	19703	19703	22253	=	xIntent	PersonX loses 10 pounds	to be healthy	PersonX 10 پوند وزن کم می کند	برای سالم بودن	to be healthy	to be healthy	1.0	1.0	1.0	False
24195	24195	24195	24195	45616	45616	45616	8164	//	xIntent	PersonX loses PersonX's nerve	to be heard	PersonX عصب PersonX را از دست می دهد	شنیده شدن	to be heard	to cause trouble	0.2972	1.0	0.2972	False
24196	24196	24196	24196	32618	32618	32618	15167	//	xIntent	PersonX loses PersonX's touch	to be emotionless	PersonX لمس PersonX را از دست می دهد	بی احساس بودن	to be emotionless	to hide their emotions	0.6782	1.0	0.6782	False
24224	24221	24224	24221	12556	12556	12556	35107	//	xIntent	PersonX loses a few pounds	to be fit	PersonX چند پوند از دست می دهد	مناسب بودن	to be fit	to destroy things	0.1104	1.0	0.1104	False
24227	24227	24227	24227	47326	47326	47326	9874	//	xIntent	PersonX loses a lot of money	to gamble	PersonX سرمایه زیادی از دست می دهد	قمار کردن	to gamble	to earn money	0.261	1.0	0.261	False
24236	24236	24236	24236	36966	36966	36966	19515	//	xIntent	PersonX loses all PersonX's money	to gamble	PersonX تمام پول PersonX را از دست می دهد	قمار کردن	to gamble	to steal	0.372	1.0	0.372	False
24248	24249	24247	24248	1187	1187	1187	41187	//	xIntent	PersonX loses fifty pounds	to be healthy	PersonX پنجاه پوند از دست می دهد	برای سالم بودن	to be healthy	to cut their losses	0.0627	1.0	0.0627	False
24250	24250	24250	24250	21797	21797	21797	24347	//	xIntent	PersonX loses five pounds	to be healthy	PersonX پنج پوند از دست می دهد	برای سالم بودن	to be healthy	to take a nap	0.294	1.0	0.294	False
24261	24260	24262	24259	5952	5952	5952	45952	//	xIntent	PersonX loses some weight	to be healthier	PersonX مقداری وزن کم می کند	سالم تر بودن	to be healthier	to be healthy	0.8771	1.0	0.8771	False
24269	24268	24267	24266	46866	46866	46866	9414	//	xIntent	PersonX loses ten pounds	to be healthy	PersonX ده پوند از دست می دهد	برای سالم بودن	to be healthy	to destroy things	0.2067	1.0	0.2067	False
24275	24275	24275	24275	8660	8660	8660	31211	//	xIntent	PersonX loses the weight	to be healthier	PersonX وزن خود را از دست می دهد	سالم تر بودن	to be healthier	to become healthy	0.8029	1.0	0.8029	False
24284	24283	24284	24283	39312	39312	39312	1860	//	xIntent	PersonX loves PersonX's ___ as PersonX's bodies	to be admired	PersonX ___ PersonX را به عنوان بدن های PersonX دوست دارد	مورد تحسین قرار گرفتن	to be admired	to be a good person	0.5714	1.0	0.5714	False
24288	24288	24288	24288	41196	41196	41196	3744	//	xIntent	PersonX loves PersonX's ___ dearly	to be nice	PersonX عاشق Person__ ___ است	خوب بودن	to be nice	to express feelings	0.4663	1.0	0.4663	False
24296	24296	24296	24296	42341	42341	42341	4889	//	xIntent	PersonX loves PersonX's country	to be patriotic	PersonX کشور PersonX را دوست دارد	میهن پرست بودن	to be patriotic	to be a good leader	0.4748	1.0	0.4748	False
24304	24305	24306	24304	41932	41932	41932	4480	//	xIntent	PersonX loves PersonX's husband	to be loved	PersonX شوهر PersonX را دوست دارد	دوست داشته شدن	to be loved	to be a friend	0.505	1.0	0.505	False
24322	24322	24322	24322	36721	36721	36721	19270	//	xIntent	PersonX loves PersonX's trip	to enjoy their trip	PersonX عاشق سفر PersonX است	برای لذت بردن از سفر خود	to enjoy their trip	to enjoy themselves	0.6987	1.0	0.6987	False
24325	24325	24325	24325	42494	42494	42494	5042	//	xIntent	PersonX loves PersonX's wife	to be happy	PersonX همسر PersonX را دوست دارد	خوشحال بودن	to be happy	to be a friend	0.4925	1.0	0.4925	False
24355	24355	24355	24355	28390	28390	28390	10939	//	xIntent	PersonX loves PersonY to death	to be loved	PersonX PersonY را تا حد مرگ دوست دارد	دوست داشته شدن	to be loved	to be a friend	0.505	1.0	0.505	False
24372	24371	24372	24371	3403	3403	3403	43403	//	xIntent	PersonX loves PersonY's ___ in sincerity	to be loving	PersonX صادقانه ___ PersonY را دوست دارد	عاشق بودن	to be loving	to be a good friend	0.488	1.0	0.488	False
24386	24386	24386	24386	42687	42687	42687	5235	//	xIntent	PersonX loves PersonY's enemies	to be nice	PersonX دشمنان PersonY را دوست دارد	خوب بودن	to be nice	to be a bully	0.3055	1.0	0.3055	False
24397	24396	24397	24396	44840	44840	44840	7388	//	xIntent	PersonX loves PersonY's mother	to be nice	PersonX مادر PersonY را دوست دارد	خوب بودن	to be nice	to be friendly	0.7492	1.0	0.7492	False
24400	24400	24400	24400	17652	17652	17652	20202	//	xIntent	PersonX loves PersonY's new hair	to be nice	PersonX موهای جدید PersonY را دوست دارد	خوب بودن	to be nice	to be friendly	0.7492	1.0	0.7492	False
24413	24413	24413	24413	16506	16506	16506	39057	//	xIntent	PersonX loves ___ better	to be loved	PersonX ___ را بهتر دوست دارد	دوست داشته شدن	to be loved	to be a good friend	0.4805	1.0	0.4805	False
24427	24430	24426	24431	46176	46176	46176	8724	//	xIntent	PersonX loves ___ very much	to be nice	PersonX ___ را خیلی دوست دارد	خوب بودن	to be nice	to be a friend	0.5178	1.0	0.5178	False
24435	24435	24435	24435	11706	11706	11706	34257	//	xIntent	PersonX loves apples	to eat	PersonX عاشق سیب است	خوردن	to eat	to express feelings	0.3228	1.0	0.3228	False
24448	24448	24448	24448	25907	25907	25907	28457	//	xIntent	PersonX loves elephants	to enjoy elephants	PersonX فیل ها را دوست دارد	برای لذت بردن از فیل ها	to enjoy elephants	to be a فیل	0.1159	1.0	0.1159	False
24451	24451	24451	24451	28607	28607	28607	11156	//	xIntent	PersonX loves every minute of it	to be happy	PersonX هر دقیقه از آن را دوست دارد	خوشحال بودن	to be happy	to be a friend	0.4925	1.0	0.4925	False
24470	24470	24470	24470	20560	20560	20560	23110	//	xIntent	PersonX loves horror movies	to be scared	PersonX عاشق فیلم های ترسناک است	ترسیدن	to be scared	to be brave	0.5604	1.0	0.5604	False
24475	24475	24475	24475	12523	12523	12523	35074	//	xIntent	PersonX loves makeup	to look good	PersonX آرایش را دوست دارد	خوب به نظر رسیدن	to look good	to be a good person	0.4827	1.0	0.4827	False
24498	24498	24498	24498	1470	1470	1470	41470	//	xIntent	PersonX loves playing sports	to be healthy	PersonX عاشق ورزش است	برای سالم بودن	to be healthy	to enjoy themselves	0.3826	1.0	0.3826	False
24505	24505	24505	24505	9193	9193	9193	31744	//	xIntent	PersonX loves shopping	to possess material things	PersonX عاشق خرید است	داشتن چیزهای مادی	to possess material things	to have a date	0.1392	1.0	0.1392	False
24514	24515	24514	24515	39330	39330	39330	1878	//	xIntent	PersonX loves the ___ much	to be nice	PersonX ___ را بسیار دوست دارد	خوب بودن	to be nice	to be a friend	0.5178	1.0	0.5178	False
24532	24532	24532	24532	23927	23927	23927	26477	//	xIntent	PersonX loves to dance	to have fun	PersonX عاشق رقصیدن است	تفریح ​​کردن	to have fun	to express their feelings	0.2551	1.0	0.2551	False
24535	24535	24535	24535	11340	11340	11340	33891	=	xIntent	PersonX loves to eat	to eat	PersonX عاشق غذا خوردن است	خوردن	to eat	to eat	1.0	1.0	1.0	False
24552	24552	24552	24552	5684	5684	5684	45684	=	xIntent	PersonX loves to ice skate	to have fun	PersonX عاشق اسکیت روی یخ است	تفریح ​​کردن	to have fun	to have fun	1.0	1.0	1.0	False
24554	24554	24554	24554	9877	9877	9877	32428	//	xIntent	PersonX loves to paint	to be artistic	PersonX عاشق نقاشی است	هنرمند بودن	to be artistic	to express their feelings	0.253	1.0	0.253	False
24571	24573	24570	24571	24433	24433	24433	26983	//	xIntent	PersonX loves to read	to learn	PersonX عاشق خواندن است	برای یادگیری	to learn	to express feelings	0.3862	1.0	0.3862	False
24579	24579	24579	24579	8868	8868	8868	31419	//	xIntent	PersonX loves to run	to be healthy	PersonX عاشق دویدن است	برای سالم بودن	to be healthy	to enjoy themselves	0.3826	1.0	0.3826	False
24589	24589	24589	24589	8544	8544	8544	31095	//	xIntent	PersonX loves very much	to be happy	PersonX خیلی دوست دارد	خوشحال بودن	to be happy	to be a friend	0.4925	1.0	0.4925	False
24591	24591	24591	24591	5386	5386	5386	45386	//	xIntent	PersonX loves video games	to have fun	PersonX عاشق بازی های ویدیویی است	تفریح ​​کردن	to have fun	to enjoy themselves	0.7696	1.0	0.7696	False
24592	24592	24592	24592	19939	19939	19939	22489	//	xIntent	PersonX loves watching movies	to be entertained	PersonX عاشق تماشای فیلم است	سرگرم شدن	to be entertained	to enjoy themselves	0.7078	1.0	0.7078	False
24608	24609	24608	24609	38105	38105	38105	653	//	xIntent	PersonX lure ___ away	to be nice	PersonX فریب ___ دور	خوب بودن	to be nice	to be a responsibility	0.3647	1.0	0.3647	False
24623	24623	24623	24623	45712	45712	45712	8260	//	xIntent	PersonX maintains PersonX's independence	to be alone	PersonX استقلال PersonX را حفظ می کند	تنها بودن	to be alone	to be a good person	0.3759	1.0	0.3759	False
24626	24626	24626	24626	42902	42902	42902	5450	//	xIntent	PersonX maintains PersonX's integrity	to be honest	PersonX یکپارچگی PersonX را حفظ می کند	صادقانه بگویم	to be honest	to be a good person	0.51	1.0	0.51	False
24633	24633	24633	24633	42517	42517	42517	5065	//	xIntent	PersonX maintains PersonX's rights	to be treated fairly	PersonX حقوق PersonX را حفظ می کند	با منصفانه رفتار شود	to be treated fairly	to be a good person	0.4843	1.0	0.4843	False
24641	24641	24641	24641	33489	33489	33489	16038	//	xIntent	PersonX maintains PersonY level	to compete with persony	PersonX سطح PersonY را حفظ می کند	برای رقابت با شخصیت	to compete with persony	to be a good person	0.2457	1.0	0.2457	False
24644	24644	24644	24644	35578	35578	35578	18127	//	xIntent	PersonX maintains PersonY relationship	to be helpful	PersonX رابطه PersonY را حفظ می کند	مفید بودن	to be helpful	to be friendly	0.6242	1.0	0.6242	False
24674	24674	24674	24674	31506	31506	31506	14055	//	xIntent	PersonX makes PersonX's bow	to be successful	PersonX تعظیم PersonX را ایجاد می کند	برای موفق شدن	to be successful	to create a new center	0.2861	1.0	0.2861	False
24698	24698	24698	24698	15485	15485	15485	38036	//	xIntent	PersonX makes PersonX's dream come true	to be happy	PersonX رویای PersonX را محقق می کند	خوشحال بودن	to be happy	to be successful	0.6275	1.0	0.6275	False
24706	24706	24706	24706	16660	16660	16660	39211	//	xIntent	PersonX makes PersonX's fortunes	to be rich	PersonX ثروت PersonX را به دست می آورد	ثروتمند بودن	to be rich	to earn money	0.5181	1.0	0.5181	False
24713	24713	24713	24713	42233	42233	42233	4781	//	xIntent	PersonX makes PersonX's living	to be able to provide for themselves	PersonX امرار معاش PersonX را می کند	تا بتوانند مایحتاج زندگی خود را تأمین کنند	to be able to provide for themselves	to be a good person	0.4528	1.0	0.4528	False
24723	24721	24724	24722	683	683	683	40683	//	xIntent	PersonX makes PersonX's own candles	to be creative	PersonX شمع های PersonX را می سازد	خلاق بودن	to be creative	to be noticed	0.4268	1.0	0.4268	False
24742	24743	24744	24742	45844	45844	45844	8392	//	xIntent	PersonX makes PersonX's rounds	to be responsible	PersonX دورهای PersonX را ایجاد می کند	مسئول بودن	to be responsible	to be in control	0.7331	1.0	0.7331	False
24753	24753	24753	24753	45831	45831	45831	8379	//	xIntent	PersonX makes PersonX's statement	to defend himself	PersonX اظهارات PersonX را بیان می کند	برای دفاع از خودش	to defend himself	to inform others	0.3209	1.0	0.3209	False
24758	24758	24758	24758	42401	42401	42401	4949	//	xIntent	PersonX makes PersonX's way in the world	to be successful	PersonX راه PersonX را در جهان باز می کند	برای موفق شدن	to be successful	to be a politician	0.4504	1.0	0.4504	False
24764	24764	24764	24764	1519	1519	1519	41519	//	xIntent	PersonX makes PersonY a gift	to be nice	PersonX PersonY را هدیه می کند	خوب بودن	to be nice	to be helpful	0.6752	1.0	0.6752	False
24769	24772	24770	24771	33882	33882	33882	16431	//	xIntent	PersonX makes PersonY acquaintance	to meet them	PersonX با PersonY آشنا می شود	برای دیدار با آنها	to meet them	to be friendly	0.5058	1.0	0.5058	False
24798	24798	24798	24798	33621	33621	33621	16170	//	xIntent	PersonX makes PersonY arrangement	to assist persony	PersonX چیدمان PersonY را انجام می دهد	برای کمک به شخص	to assist persony	to be respectful	0.3532	1.0	0.3532	False
24814	24815	24813	24814	35398	35398	35398	17947	//	xIntent	PersonX makes PersonY award	to apriciate	PersonX جایزه PersonY را می سازد	زرد کردن	to apriciate	to be a good friend	0.2482	1.0	0.2482	False
24819	24819	24819	24819	35183	35183	35183	17732	//	xIntent	PersonX makes PersonY bed	to help persony	PersonX تختخواب PersonY را ایجاد می کند	برای کمک به شخص	to help persony	to be a bully	0.2575	1.0	0.2575	False
24849	24849	24849	24849	33762	33762	33762	16311	//	xIntent	PersonX makes PersonY diagnosis	to treat persony's health	PersonX تشخیص PersonY را می دهد	برای درمان سلامتی شخص	to treat persony's health	to destroy persony	0.5336	1.0	0.5336	False
24857	24857	24857	24857	33792	33792	33792	16341	//	xIntent	PersonX makes PersonY evaluation	to assess persony's performance	PersonX ارزیابی PersonY را انجام می دهد	برای ارزیابی عملکرد شخص	to assess persony's performance	to help persony	0.6745	1.0	0.6745	False
24869	24869	24869	24869	34567	34567	34567	17116	//	xIntent	PersonX makes PersonY fortune	to be successful	PersonX باعث می شود PersonY ثروت داشته باشد	برای موفق شدن	to be successful	to earn a living	0.5275	1.0	0.5275	False
24870	24870	24870	24870	35337	35337	35337	17886	//	xIntent	PersonX makes PersonY gesture	to greet persony	PersonX ژست PersonY را می گیرد	به شخصه سلام کردن	to greet persony	to steal persony's identity	0.4897	1.0	0.4897	False
24873	24875	24873	24875	35197	35197	35197	17746	//	xIntent	PersonX makes PersonY guess	to surprise person y	PersonX باعث می شود PersonY حدس بزند	تعجب کردن شخص y	to surprise person y	to be a parent	0.2443	1.0	0.2443	False
24892	24892	24892	24892	34628	34628	34628	17177	//	xIntent	PersonX makes PersonY incision	to heal persony	PersonX برش PersonY را ایجاد می کند	برای بهبود شخصیت	to heal persony	to be a good person	0.3642	1.0	0.3642	False
24908	24908	24908	24908	381	381	381	40381	//	xIntent	PersonX makes PersonY living	to help persony	PersonX باعث می شود PersonY زندگی کند	برای کمک به شخص	to help persony	to be a good friend	0.3973	1.0	0.3973	False
24948	24948	24948	24948	33545	33545	33545	16094	//	xIntent	PersonX makes PersonY provision	to help persony	PersonX فراهم می کند PersonY	برای کمک به شخص	to help persony	to be helpful	0.6903	1.0	0.6903	False
25000	24999	25000	24999	32274	32274	32274	14823	//	xIntent	PersonX makes PersonY's blood boil	to make persony angry	PersonX خون PersonY را به جوش می آورد	شخص را عصبانی کند	to make persony angry	to celebrate	0.2547	1.0	0.2547	False
25011	25010	25009	25012	3127	3127	3127	43127	//	xIntent	PersonX makes PersonY's coffee	to be helpful	PersonX قهوه PersonY را درست می کند	مفید بودن	to be helpful	to be a good friend	0.5338	1.0	0.5338	False
25049	25047	25050	25048	42800	42800	42800	5348	//	xIntent	PersonX makes PersonY's plans	to be helpful	PersonX برنامه های PersonY را می سازد	مفید بودن	to be helpful	to help persony	0.6903	1.0	0.6903	False
25084	25084	25084	25084	22991	22991	22991	25541	//	xIntent	PersonX makes ___ back home	to be alone	PersonX ___ را به خانه برگرداند	تنها بودن	to be alone	to cause a scene	0.2011	1.0	0.2011	False
25126	25126	25126	25126	14018	14018	14018	36569	//	xIntent	PersonX makes ___ for lunch	to eat	PersonX ___ را برای ناهار درست می کند	خوردن	to eat	to avoid getting a tan	0.3156	1.0	0.3156	False
25140	25138	25140	25138	22794	22794	22794	25344	//	xIntent	PersonX makes ___ home safely	to be safe	PersonX با خیال راحت ___ خانه را ایجاد می کند	ایمن بودن	to be safe	to be a good friend	0.2721	1.0	0.2721	False
25174	25173	25174	25173	17442	17442	17442	39993	//	xIntent	PersonX makes ___ last night	to eat	PersonX شب گذشته ___ می سازد	خوردن	to eat	to be a singer	0.2588	1.0	0.2588	False
25195	25194	25195	25194	22759	22759	22759	25309	//	xIntent	PersonX makes ___ one night	to eat	PersonX یک شب ___ درست می کند	خوردن	to eat	to be a good friend	0.2851	1.0	0.2851	False
25201	25201	25201	25201	22894	22894	22894	25444	//	xIntent	PersonX makes ___ right away	to be responsible	PersonX ___ را فوراً می سازد	مسئول بودن	to be responsible	to be productive	0.4608	1.0	0.4608	False
25203	25202	25203	25202	13396	13396	13396	35947	//	xIntent	PersonX makes ___ safely	to be safe	PersonX ___ را با خیال راحت می سازد	ایمن بودن	to be safe	to be a good friend	0.2721	1.0	0.2721	False
25207	25207	25207	25207	13403	13403	13403	35954	//	xIntent	PersonX makes ___ though	to be independent	هرچند PersonX ___ را می سازد	مستقل بودن	to be independent	to create a novel	0.2351	1.0	0.2351	False
25210	25211	25210	25211	14746	14746	14746	37297	//	xIntent	PersonX makes ___ to sell	to make money	PersonX ___ را برای فروش ایجاد می کند	پول در آوردن	to make money	to be a good salesman	0.4663	1.0	0.4663	False
25213	25213	25213	25213	15187	15187	15187	37738	//	xIntent	PersonX makes ___ to the finals	to be the best	PersonX ___ را به فینال می رساند	بهترین بودن	to be the best	to earn a medal	0.3685	1.0	0.3685	False
25219	25219	25219	25219	13595	13595	13595	36146	//	xIntent	PersonX makes ___ today	to be creative	PersonX امروز ___ را می سازد	خلاق بودن	to be creative	to be productive	0.6258	1.0	0.6258	False
25236	25233	25236	25233	10932	10932	10932	33483	//	xIntent	PersonX makes a basket	to create something	PersonX یک سبد درست می کند	ایجاد چیزی	to create something	to be a good worker	0.3204	1.0	0.3204	False
25240	25240	25240	25240	8008	8008	8008	30559	//	xIntent	PersonX makes a bet	to gamble	PersonX شرط بندی می کند	قمار کردن	to gamble	to cut their losses	0.103	1.0	0.103	False
25245	25246	25245	25246	30078	30078	30078	12627	=	xIntent	PersonX makes a big deal	to exaggerate	PersonX makes a big deal	to exaggerate	to exaggerate	to exaggerate	1.0	1.0	1.0	False
25248	25248	25248	25248	21806	21806	21806	24356	//	xIntent	PersonX makes a bowl of cereal	to eat	PersonX یک کاسه غلات درست می کند	خوردن	to eat	to bully someone	0.1921	1.0	0.1921	False
25258	25257	25256	25258	8857	8857	8857	31408	//	xIntent	PersonX makes a call	to talk to someone	PersonX تماس می گیرد	با کسی صحبت کردن	to talk to someone	to reach a conclusion	0.2893	1.0	0.2893	False
25282	25282	25282	25282	16909	16909	16909	39460	//	xIntent	PersonX makes a donation to these projects	to help	PersonX به این پروژه ها کمک مالی می کند	برای کمک به	to help	to accomplish a goal	0.5375	1.0	0.5375	False
25285	25285	25285	25285	11572	11572	11572	34123	//	xIntent	PersonX makes a dress	to wear something unique	PersonX یک لباس درست می کند	پوشیدن چیزی منحصر به فرد	to wear something unique	to لباس	0.2018	1.0	0.2018	False
25289	25288	25289	25288	2266	2266	2266	42266	//	xIntent	PersonX makes a face	to be funny	PersonX چهره می کند	خنده دار بودن	to be funny	to be attractive	0.4447	1.0	0.4447	False
25315	25312	25316	25314	22086	22086	22086	24636	//	xIntent	PersonX makes a funny noise	to make people laugh	PersonX سر و صدای خنده داری ایجاد می کند	برای خنداندن مردم	to make people laugh	to express themselves	0.3514	1.0	0.3514	False
25335	25337	25336	25335	20064	20064	20064	22614	//	xIntent	PersonX makes a ham sandwich	to eat	PersonX ساندویچ ژامبون درست می کند	خوردن	to eat	to secure the room	0.1065	1.0	0.1065	False
25346	25344	25345	25346	22024	22024	22024	24574	//	xIntent	PersonX makes a huge difference	to be helpful	PersonX تفاوت زیادی ایجاد می کند	مفید بودن	to be helpful	to be a better person	0.5139	1.0	0.5139	False
25358	25359	25358	25359	32957	32957	32957	15506	//	xIntent	PersonX makes a killing	to make money	PersonX یک قتل می کند	پول در آوردن	to make money	to murder someone	0.1666	1.0	0.1666	False
25364	25364	25364	25364	9241	9241	9241	31792	//	xIntent	PersonX makes a list	to be organized	PersonX لیستی تهیه می کند	سازمان یافته باشد	to be organized	to be a good person	0.183	1.0	0.183	False
25393	25393	25393	25393	12258	12258	12258	34809	=	xIntent	PersonX makes a meal	to eat	PersonX یک وعده غذایی درست می کند	خوردن	to eat	to eat	1.0	1.0	1.0	False
25394	25395	25394	25395	27999	27999	27999	10548	//	xIntent	PersonX makes a mental note	to remember	PersonX یادداشت ذهنی می کند	به خاطر سپردن	to remember	to be aware of their emotions	0.2242	1.0	0.2242	False
