	Unnamed: 0	Unnamed: 0.1	Unnamed: 0.1.1	Unnamed: 0.1.1.1	Unnamed: 0.1.1.1.1	Unnamed: 0.1.1.1.1.1	Unnamed: 0.1.1.1.1.1.1	compare	prefix	input_text	target_text	input_text_fa	target_text_fa	pred_text1	pred_text2	preds_score	pred1_score	pred2_score	bookmark
11209	11209	11209	11209	43197	43197	43197	5745	//	xIntent	PersonX feels PersonY's pulse	to check if persony is alive	PersonX نبض PersonY را احساس می کند	برای بررسی اینکه آیا شخص زنده است	to check if persony is alive	to be noticed	0.2997	1.0	0.2997	False
11228	11228	11228	11228	11667	11667	11667	34218	//	xIntent	PersonX feels adventurous	to explore	PersonX احساس ماجراجویی می کند	کاوش	to explore	to be noticed	0.498	1.0	0.498	False
11239	11239	11239	11239	27281	27281	27281	29831	//	xIntent	PersonX feels glad	to be happy	PersonX احساس خوشحالی می کند	خوشحال بودن	to be happy	to be emotionally stable	0.496	1.0	0.496	False
11266	11266	11266	11266	5783	5783	5783	45783	//	xIntent	PersonX feels much better after	to feel good	PersonX بعد از آن احساس بهتری دارد	احساس خوبی داشتن	to feel good	to emotionally satisfy his needs	0.4221	1.0	0.4221	False
11268	11268	11268	11268	1149	1149	1149	41149	//	xIntent	PersonX feels much better afterwards	to feel better	بعد از آن PersonX احساس بهتری دارد	بهتر شدن	to feel better	to be emotionally stable	0.5084	1.0	0.5084	False
11270	11269	11271	11270	28404	28404	28404	10953	//	xIntent	PersonX feels much better now	to feel better	اکنون PersonX حال بسیار بهتری دارد	بهتر شدن	to feel better	to be a better person	0.5726	1.0	0.5726	False
11284	11284	11284	11284	30640	30640	30640	13189	//	xIntent	PersonX feels really weird	to leave	PersonX واقعاً عجیب است	ترك كردن	to leave	to forget	0.5526	1.0	0.5526	False
11299	11299	11299	11299	8813	8813	8813	31364	//	xIntent	PersonX feels very confident	to feel good	PersonX بسیار احساس اطمینان می کند	احساس خوبی داشتن	to feel good	to be noticed	0.3761	1.0	0.3761	False
11314	11315	11314	11315	17907	17907	17907	20457	//	xIntent	PersonX fees PersonY's cat	to help persony	PersonX هزینه گربه PersonY را پرداخت می کند	برای کمک به شخص	to help persony	to steal	0.3345	1.0	0.3345	False
11322	11325	11322	11325	12471	12471	12471	35022	//	xIntent	PersonX fees the baby	to take care of the baby	PersonX به کودک هزینه می دهد	برای مراقبت از کودک	to take care of the baby	to take care of someone	0.5992	1.0	0.5992	False
11328	11328	11328	11328	9721	9721	9721	32272	//	xIntent	PersonX fees the birds	to make them happy	PersonX هزینه پرندگان را می گیرد	تا آنها را خوشحال کند	to make them happy	to cause trouble	0.2419	1.0	0.2419	False
11360	11356	11361	11358	43303	43303	43303	5851	//	xIntent	PersonX fights PersonX's battles	to stand out	PersonX با نبردهای PersonX می جنگد	به ایستادگی کردن	to stand out	to be a fighter	0.3421	1.0	0.3421	False
11433	11431	11433	11431	37719	37719	37719	267	//	xIntent	PersonX fights the ___ alone	to be heroic	PersonX به تنهایی با ___ می جنگد	قهرمانانه بودن	to be heroic	to be a fighter	0.6261	1.0	0.6261	False
11437	11437	11437	11437	37203	37203	37203	19752	//	xIntent	PersonX files PersonY's taxes	to help persony	PersonX مالیات PersonY را پرونده می کند	برای کمک به شخص	to help persony	to help person y	0.7751	1.0	0.7751	False
11450	11450	11450	11450	11177	11177	11177	33728	//	xIntent	PersonX files for bankruptcy	to absolve some debt	پرونده PersonX برای ورشکستگی ارائه می شود	برای حذف برخی از بدهی ها	to absolve some debt	to sharpen their skills	0.1493	1.0	0.1493	False
11470	11470	11470	11470	37444	37444	37444	19993	//	xIntent	PersonX fills PersonX's cart	to shop	PersonX سبد PersonX را پر می کند	خرید	to shop	to be noticed	0.3551	1.0	0.3551	False
11479	11479	11479	11479	44977	44977	44977	7525	//	xIntent	PersonX fills PersonX's glass	to drink	PersonX لیوان PersonX را پر می کند	نوشیدن	to drink	to be a bully	0.2952	1.0	0.2952	False
11496	11496	11496	11496	38724	38724	38724	1272	//	xIntent	PersonX fills PersonY's ___ to lie	to manipulate persony	PersonX ___ PersonY را برای دروغ پر می کند	برای دستکاری شخصیت	to manipulate persony	to be a bully	0.3187	1.0	0.3187	False
11513	11515	11514	11513	45224	45224	45224	7772	//	xIntent	PersonX fills PersonY's pipe	to be helpful	PersonX لوله PersonY را پر می کند	مفید بودن	to be helpful	to display their emotions	0.2629	1.0	0.2629	False
11517	11517	11517	11517	31242	31242	31242	13791	//	xIntent	PersonX fills PersonY's shoes	to help persony	PersonX کفش های PersonY را پر می کند	برای کمک به شخص	to help persony	to be noticed	0.3834	1.0	0.3834	False
11520	11520	11520	11520	18924	18924	18924	21474	//	xIntent	PersonX fills PersonY's tank	to help persony	PersonX مخزن PersonY را پر می کند	برای کمک به شخص	to help persony	to make sure persony isn't distracted from a pressing matter	0.5037	1.0	0.5037	False
11529	11529	11529	11529	46439	46439	46439	8987	//	xIntent	PersonX fills ___ with water	to have a container full of water	PersonX ___ را از آب پر می کند	ظرفی پر از آب داشته باشید	to have a container full of water	to leave the garden	0.226	1.0	0.226	False
11536	11537	11536	11537	30783	30783	30783	13332	//	xIntent	PersonX fills in the blank	to solve the puzzle	PersonX جای خالی را پر می کند	برای حل معما	to solve the puzzle	to hide their sadness	0.1484	1.0	0.1484	False
11549	11547	11549	11547	27052	27052	27052	29602	//	xIntent	PersonX fills the tub	to take bath	PersonX وان را پر می کند	حمام کردن	to take bath	to hide their sadness	0.1468	1.0	0.1468	False
11563	11563	11563	11563	21096	21096	21096	23646	//	xIntent	PersonX finally asked PersonY	to know something	PersonX سرانجام از PersonY پرسید	چیزی دانستن	to know something	to help persony	0.4386	1.0	0.4386	False
11574	11574	11574	11574	1727	1727	1727	41727	//	xIntent	PersonX finally came	to arrive	بالاخره PersonX آمد	رسیدن	to arrive	to leave	0.6426	1.0	0.6426	False
11588	11588	11588	11588	1488	1488	1488	41488	//	xIntent	PersonX finally fell asleep	to rest	PersonX سرانجام به خواب رفت	استراحت کردن	to rest	to leave	0.463	1.0	0.463	False
11627	11627	11627	11627	11630	11630	11630	34181	//	xIntent	PersonX finally looked	to see what is happening	PersonX بالاخره نگاه کرد	برای دیدن آنچه اتفاق می افتد	to see what is happening	to explain something	0.45	1.0	0.45	False
11660	11660	11660	11660	6074	6074	6074	46074	//	xIntent	PersonX finally sat down	to relax	بالاخره PersonX نشست	آرام شدن	to relax	to accomplish something	0.372	1.0	0.372	False
11665	11666	11668	11665	13750	13750	13750	36301	//	xIntent	PersonX finally saved ___	to buy something	PersonX بالاخره ___ ذخیره کرد	برای خریدن چیزی	to buy something	to destroy things	0.3689	1.0	0.3689	False
11676	11676	11676	11676	5443	5443	5443	45443	//	xIntent	PersonX finally saved up enough	to buy something	در نهایت PersonX به اندازه کافی پس انداز کرد	برای خریدن چیزی	to buy something	to leave	0.3109	1.0	0.3109	False
11680	11680	11680	11680	21274	21274	21274	23824	//	xIntent	PersonX finally saved up enough money	to buy something	PersonX بالاخره پس انداز کافی کرد	برای خریدن چیزی	to buy something	to obey the rules	0.28	1.0	0.28	False
11686	11684	11687	11685	9014	9014	9014	31565	//	xIntent	PersonX finally settled	to be safe	PersonX سرانجام حل و فصل شد	ایمن بودن	to be safe	to be حلed	0.2395	1.0	0.2395	False
11692	11692	11692	11692	26017	26017	26017	28567	//	xIntent	PersonX finally stopped	to halt	PersonX بالاخره متوقف شد	متوقف کردن	to halt	to stop eating	0.5447	1.0	0.5447	False
11694	11694	11694	11694	2230	2230	2230	42230	//	xIntent	PersonX finally told	to tell someone something	بالاخره PersonX گفت	چیزی را به کسی گفتن	to tell someone something	to be a good friend	0.4152	1.0	0.4152	False
11751	11751	11751	11751	5312	5312	5312	45312	//	xIntent	PersonX finds PersonX's lost dog	to be a good owner	PersonX سگ گمشده PersonX را پیدا می کند	مالک خوب بودن	to be a good owner	to leave	0.2596	1.0	0.2596	False
11766	11766	11766	11766	36220	36220	36220	18769	//	xIntent	PersonX finds PersonX's seat	to sit down	PersonX صندلی PersonX را پیدا می کند	برای نشستن	to sit down	to be able to go to the bathroom	0.3539	1.0	0.3539	False
11773	11775	11773	11775	17492	17492	17492	20042	//	xIntent	PersonX finds PersonX's way back home	to go home	PersonX بازگشت PersonX به خانه را پیدا می کند	رفتن به خانه	to go home	to be alone	0.3633	1.0	0.3633	False
11797	11798	11797	11798	43982	43982	43982	6530	//	xIntent	PersonX finds PersonY evidence	to solve a case	PersonX شواهد PersonY را پیدا می کند	برای حل یک پرونده	to solve a case	to be a friend	0.2276	1.0	0.2276	False
11840	11840	11840	11840	18037	18037	18037	20587	//	xIntent	PersonX finds PersonY's first class	to help persony	PersonX کلاس اول PersonY را پیدا می کند	برای کمک به شخص	to help persony	to be a good friend	0.3973	1.0	0.3973	False
11848	11848	11848	11848	5218	5218	5218	45218	//	xIntent	PersonX finds PersonY's hotel	to visit persony	PersonX هتل PersonY را پیدا می کند	برای بازدید شخصی	to visit persony	to make money	0.1393	1.0	0.1393	False
11860	11860	11860	11860	37243	37243	37243	19792	//	xIntent	PersonX finds PersonY's mom	to help persony	PersonX مادر PersonY را پیدا می کند	برای کمک به شخص	to help persony	to be a parent	0.2752	1.0	0.2752	False
11892	11892	11892	11892	38266	38266	38266	814	//	xIntent	PersonX finds ___ for PersonY's souls	to be helpful	PersonX ___ را برای روح PersonY پیدا می کند	مفید بودن	to be helpful	to be a good friend	0.5338	1.0	0.5338	False
11898	11898	11898	11898	23085	23085	23085	25635	//	xIntent	PersonX finds ___ in PersonX's backyard	to find treasure	PersonX ___ را در حیاط پشتی PersonX پیدا می کند	برای یافتن گنج	to find treasure	to be a good parent	0.1241	1.0	0.1241	False
11919	11920	11919	11920	38315	38315	38315	863	//	xIntent	PersonX finds ___ in the sector	to be successful	PersonX ___ را در بخش پیدا می کند	برای موفق شدن	to be successful	to be in control	0.5131	1.0	0.5131	False
11963	11967	11964	11965	13772	13772	13772	36323	//	xIntent	PersonX finds ___ to wear	to look good	PersonX ___ را برای پوشیدن پیدا می کند	خوب به نظر رسیدن	to look good	to be noticed	0.4253	1.0	0.4253	False
11970	11970	11970	11970	23148	23148	23148	25698	//	xIntent	PersonX finds ___ under PersonX's bed	to find something	PersonX ___ را در زیر تخت PersonX پیدا می کند	پیدا کردن چیزی	to find something	to avoid danger	0.3642	1.0	0.3642	False
11977	11977	11977	11977	13352	13352	13352	35903	//	xIntent	PersonX finds ___ under the couch	to change the channel	PersonX ___ را در زیر کاناپه پیدا می کند	برای تغییر کانال	to change the channel	to hide something	0.1162	1.0	0.1162	False
11980	11980	11980	11980	40623	40623	40623	3171	//	xIntent	PersonX finds ___ unto PersonX's souls	to find peace	PersonX ___ را به روح PersonX پیدا می کند	برای یافتن آرامش	to find peace	to be a good friend	0.3357	1.0	0.3357	False
11996	11996	11996	11996	28916	28916	28916	11465	//	xIntent	PersonX finds a cause of death	to solve a crime	PersonX علت مرگ را پیدا می کند	برای حل یک جرم	to solve a crime	to become a hero	0.3707	1.0	0.3707	False
11998	11998	11998	11998	11492	11492	11492	34043	//	xIntent	PersonX finds a cave	to search the countryside	PersonX یک غار پیدا می کند	برای جستجوی حومه	to search the countryside	to be a pioneer	0.3711	1.0	0.3711	False
12028	12028	12028	12028	20494	20494	20494	23044	//	xIntent	PersonX finds a new book	to read	PersonX کتاب جدیدی پیدا می کند	خواندن	to read	to be noticed	0.3513	1.0	0.3513	False
12035	12040	12039	12038	3940	3940	3940	43940	//	xIntent	PersonX finds a new job	to make money	PersonX شغل جدیدی پیدا می کند	پول در آوردن	to make money	to earn money	0.8908	1.0	0.8908	False
12061	12061	12061	12061	10416	10416	10416	32967	//	xIntent	PersonX finds a seat	to sit down	PersonX صندلی پیدا می کند	برای نشستن	to sit down	to be able to go to the bathroom	0.3539	1.0	0.3539	False
12064	12064	12064	12064	11129	11129	11129	33680	//	xIntent	PersonX finds a snake	to observe a reptile	PersonX یک مار پیدا می کند	برای مشاهده یک خزنده	to observe a reptile	to make a mistake	0.1199	1.0	0.1199	False
12068	12068	12068	12068	11576	11576	11576	34127	//	xIntent	PersonX finds a store	to buy something	PersonX فروشگاهی پیدا می کند	برای خریدن چیزی	to buy something	to get something	0.8155	1.0	0.8155	False
12086	12086	12086	12086	24755	24755	24755	27305	=	xIntent	PersonX finds food	to eat	PersonX غذا پیدا می کند	خوردن	to eat	to eat	1.0	1.0	1.0	False
12100	12100	12100	12100	26809	26809	26809	29359	//	xIntent	PersonX finds my dog	to help out	PersonX سگ من را پیدا می کند	کمک کردن	to help out	to be a gentle	0.4078	1.0	0.4078	False
12121	12121	12121	12121	26412	26412	26412	28962	//	xIntent	PersonX finds one on ebay	to buy it	PersonX یکی را در ebay پیدا می کند	خریدنش	to buy it	to buy something	0.8247	1.0	0.8247	False
12128	12128	12128	12128	32941	32941	32941	15490	//	xIntent	PersonX finds oneself	to find harmony within themselves	PersonX خودش را پیدا می کند	تا در درون خود هماهنگی پیدا کنند	to find harmony within themselves	to be a gentle	0.4352	1.0	0.4352	False
12155	12155	12155	12155	47338	47338	47338	9886	//	xIntent	PersonX finds something to eat	to eat	PersonX چیزی برای خوردن پیدا می کند	خوردن	to eat	to satisfy their hunger	0.657	1.0	0.657	False
12177	12177	12177	12177	6214	6214	6214	46214	//	xIntent	PersonX finds the doll	to help the little girl	PersonX عروسک را پیدا می کند	برای کمک به دختر کوچک	to help the little girl	to make a relationship	0.2189	1.0	0.2189	False
12184	12185	12184	12185	25258	25258	25258	27808	//	xIntent	PersonX finds the key	to lock the door	PersonX کلید را پیدا می کند	برای قفل کردن در	to lock the door	to satisfy their curiosity	0.2421	1.0	0.2421	False
12196	12196	12196	12196	2747	2747	2747	42747	//	xIntent	PersonX finds the most eggs	to win the hunt	PersonX بیشترین تخم را پیدا می کند	برای برنده شدن در این شکار	to win the hunt	to become more stylish.	0.2014	1.0	0.2014	False
12201	12201	12201	12201	97	97	97	40097	//	xIntent	PersonX finds the net	to use it	PersonX شبکه را پیدا می کند	استفاده از آن	to use it	to be noticed	0.382	1.0	0.382	False
12204	12204	12204	12204	5522	5522	5522	45522	//	xIntent	PersonX finds the one PersonY wanted	to help persony	PersonX شخصی را پیدا می کند که تحت تعقیب است	برای کمک به شخص	to help persony	to be a parent	0.2752	1.0	0.2752	False
12213	12211	12209	12213	17086	17086	17086	39637	//	xIntent	PersonX finds the perfect dress	to look nice	PersonX لباس کامل را پیدا می کند	خوب به نظر رسیدن	to look nice	to be noticed	0.4234	1.0	0.4234	False
12226	12226	12226	12226	19986	19986	19986	22536	//	xIntent	PersonX finds the perfect spot	to be comfortable	PersonX نقطه عالی را پیدا می کند	راحت بودن	to be comfortable	to be attractive	0.4825	1.0	0.4825	False
12245	12245	12245	12245	9926	9926	9926	32477	//	xIntent	PersonX finds the remote	to watch tv	PersonX ریموت را پیدا می کند	به تماشای تلویزیون	to watch tv	to become a scientist	0.2336	1.0	0.2336	False
12254	12254	12254	12254	11453	11453	11453	34004	//	xIntent	PersonX finds the smell	to find the source of the smell	PersonX بو را پیدا می کند	برای پیدا کردن منبع بو	to find the source of the smell	to be noticed	0.2921	1.0	0.2921	False
12269	12271	12270	12272	23725	23725	23725	26275	//	xIntent	PersonX finds work	to make money	PersonX کار پیدا می کند	پول در آوردن	to make money	to be productive	0.5204	1.0	0.5204	False
12274	12274	12274	12274	16047	16047	16047	38598	//	xIntent	PersonX finishes PersonX's book	to read	PersonX کتاب PersonX را تمام می کند	خواندن	to read	to be noticed	0.3513	1.0	0.3513	False
12276	12276	12276	12276	15327	15327	15327	37878	//	xIntent	PersonX finishes PersonX's breakfast	to eat	PersonX صبحانه PersonX را تمام می کند	خوردن	to eat	to be a good person	0.2615	1.0	0.2615	False
12285	12283	12282	12284	15866	15866	15866	38417	//	xIntent	PersonX finishes PersonX's degree	to get a good job	PersonX مدرک PersonX را به پایان می رساند	برای به دست آوردن یک کار خوب	to get a good job	to be noticed	0.2836	1.0	0.2836	False
12286	12286	12286	12286	43488	43488	43488	6036	//	xIntent	PersonX finishes PersonX's education	to get a good job	PersonX تحصیلات PersonX را به پایان می رساند	برای به دست آوردن یک کار خوب	to get a good job	to graduate	0.4288	1.0	0.4288	False
12308	12307	12306	12305	17696	17696	17696	20246	//	xIntent	PersonX finishes PersonX's paper	to get a good grade	PersonX مقاله PersonX را به پایان می رساند	برای گرفتن نمره خوب	to get a good grade	to inform	0.3067	1.0	0.3067	False
12350	12348	12351	12349	17186	17186	17186	39737	//	xIntent	PersonX finishes PersonY's sentence	to be rude	PersonX حکم PersonY را به پایان می رساند	بی ادب بودن	to be rude	to punish persony	0.4847	1.0	0.4847	False
12353	12353	12353	12353	5073	5073	5073	45073	//	xIntent	PersonX finishes PersonY's song	to be helpful	PersonX آهنگ PersonY را تمام می کند	مفید بودن	to be helpful	to express his talents	0.4112	1.0	0.4112	False
12383	12384	12385	12383	6444	6444	6444	46444	//	xIntent	PersonX finishes the book	to read	PersonX کتاب را تمام می کند	خواندن	to read	to be noticed	0.3513	1.0	0.3513	False
12393	12393	12393	12393	25878	25878	25878	28428	//	xIntent	PersonX finishes the hike	to be healthy	PersonX پیاده روی را به پایان می رساند	برای سالم بودن	to be healthy	to avoid a confrontation	0.1235	1.0	0.1235	False
12397	12395	12397	12395	10948	10948	10948	33499	//	xIntent	PersonX finishes the marathon	to finish the task	PersonX ماراتن را به پایان می رساند	برای پایان دادن به کار	to finish the task	to avoid getting married	0.0668	1.0	0.0668	False
12398	12398	12398	12398	25380	25380	25380	27930	//	xIntent	PersonX finishes the novel	to read the book	PersonX رمان را تمام می کند	برای خواندن کتاب	to read the book	to express his talents	0.4034	1.0	0.4034	False
12420	12418	12419	12417	21646	21646	21646	24196	//	xIntent	PersonX finishes the whole thing	to be finished	PersonX کار را تمام می کند	تمام شود	to be finished	to be a good person	0.2859	1.0	0.2859	False
12432	12432	12432	12432	37017	37017	37017	19566	//	xIntent	PersonX fires PersonY's rifle	to shoot a gun	PersonX تفنگ PersonY را شلیک می کند	برای شلیک اسلحه	to shoot a gun	to be mean	0.2856	1.0	0.2856	False
12460	12460	12460	12460	32954	32954	32954	15503	//	xIntent	PersonX fish or cut bait	to eat	PersonX ماهی یا طعمه بریده شده	خوردن	to eat	to طعمه a funny joke	0.2909	1.0	0.2909	False
12470	12470	12470	12470	40947	40947	40947	3495	//	xIntent	PersonX fits the ___ well	to be chosen to fill the position	PersonX به خوبی با ___ متناسب است	برای پر کردن موقعیت انتخاب شود	to be chosen to fill the position	to be a good friend	0.1569	1.0	0.1569	False
12521	12524	12522	12523	22117	22117	22117	24667	//	xIntent	PersonX fixes the air conditioner	to cool down	PersonX کولر را تعمیر می کند	خنک شدن	to cool down	to تعمیر a broken item	0.2335	1.0	0.2335	False
12533	12535	12533	12535	9756	9756	9756	32307	//	xIntent	PersonX fixes the issue	to solve the problem	PersonX این مشکل را برطرف می کند	برای حل مشکل	to solve the problem	to be a problem	0.6683	1.0	0.6683	False
12537	12537	12537	12537	2493	2493	2493	42493	//	xIntent	PersonX fixes the leak	to fix it	PersonX نشت را برطرف می کند	برای رفع آن	to fix it	to avoid getting hurt	0.1982	1.0	0.1982	False
12545	12546	12547	12545	27142	27142	27142	29692	//	xIntent	PersonX fixes the roof	to be helpful	PersonX سقف را درست می کند	مفید بودن	to be helpful	to avoid getting hit	0.2598	1.0	0.2598	False
12562	12562	12562	12562	12394	12394	12394	34945	//	xIntent	PersonX flashes behind PersonY	to cause trouble	PersonX پشت PersonY چشمک می زند	برای ایجاد دردسر	to cause trouble	to be alone	0.2191	1.0	0.2191	False
12567	12567	12567	12567	2416	2416	2416	42416	//	xIntent	PersonX flashes lights	to illuminate the area	PersonX چراغ ها را چشمک می زند	برای روشنایی منطقه	to illuminate the area	to leave	0.0619	1.0	0.0619	False
12570	12570	12570	12570	29259	29259	29259	11808	//	xIntent	PersonX flicks PersonY's tongue	to be annoying	PersonX زبان PersonY را تکان می دهد	آزار دهنده بودن	to be annoying	to be rude	0.7234	1.0	0.7234	False
12572	12572	12572	12572	31579	31579	31579	14128	//	xIntent	PersonX flicks the bean	to learn more about it	PersonX باقلا را لمس می کند	برای کسب اطلاعات بیشتر در مورد آن	to learn more about it	to be noticed	0.2886	1.0	0.2886	False
12576	12576	12576	12576	36478	36478	36478	19027	//	xIntent	PersonX flies PersonX's kite	to have fun	PersonX با بادبادک PersonX پرواز می کند	تفریح ​​کردن	to have fun	to obey the rules	0.2807	1.0	0.2807	False
12579	12581	12579	12581	15653	15653	15653	38204	//	xIntent	PersonX flies PersonY's kite	to have fun	PersonX با بادبادک PersonY پرواز می کند	تفریح ​​کردن	to have fun	to be angry	0.3581	1.0	0.3581	False
12583	12583	12583	12583	24615	24615	24615	27165	//	xIntent	PersonX flies a kite	to have fun	PersonX با بادبادک پرواز می کند	تفریح ​​کردن	to have fun	to obey the باد	0.1617	1.0	0.1617	False
12597	12598	12597	12598	11795	11795	11795	34346	//	xIntent	PersonX flies back	to go home	PersonX به عقب پرواز می کند	رفتن به خانه	to go home	to go somewhere	0.707	1.0	0.707	False
12618	12616	12614	12618	31249	31249	31249	13798	//	xIntent	PersonX flies off at a tangent	to make a point	PersonX در حالت مماس پرواز می کند	برای اشاره کردن	to make a point	to leave	0.2691	1.0	0.2691	False
12619	12619	12619	12619	26084	26084	26084	28634	//	xIntent	PersonX flies on a plane	to go on vacation	PersonX با هواپیما پرواز می کند	رفتن به تعطیلات	to go on vacation	to go to the show	0.4476	1.0	0.4476	False
12623	12623	12623	12623	32773	32773	32773	15322	//	xIntent	PersonX flies out of the traps	to show off skills	PersonX از تله ها پرواز می کند	برای به رخ کشیدن مهارت ها	to show off skills	to avoid getting hit	0.4163	1.0	0.4163	False
12625	12626	12624	12625	33247	33247	33247	15796	//	xIntent	PersonX flies the flag	honor their country	PersonX پرچم را به اهتزاز در می آورد	کشورشان را گرامی بدارند	honor their country	to express their emotions	0.3532	1.0	0.3532	False
12634	12634	12634	12634	30928	30928	30928	13477	//	xIntent	PersonX flips PersonX's wig	to be funny	PersonX کلاه گیس PersonX را برمی گرداند	خنده دار بودن	to be funny	to hide their intentions	0.217	1.0	0.217	False
12647	12647	12647	12647	309	309	309	40309	//	xIntent	PersonX flogs the log	to be feared	PersonX ورود به سیستم را شلاق می زند	ترسیدن	to be feared	to escape from a situation	0.4592	1.0	0.4592	False
12659	12659	12659	12659	9583	9583	9583	32134	//	xIntent	PersonX flushes the toilet	to be considerate	PersonX توالت را شستشو می دهد	با ملاحظه بودن	to be considerate	to clean	0.2754	1.0	0.2754	False
12668	12668	12668	12668	4026	4026	4026	44026	//	xIntent	PersonX folds PersonY's arms	to be comforting	PersonX بازوهای PersonY را جمع می کند	دلداری دادن	to be comforting	to be a good friend	0.4539	1.0	0.4539	False
12675	12672	12676	12674	27965	27965	27965	10514	//	xIntent	PersonX folds PersonY's hands	to be friendly	PersonX دست های PersonY را جمع می کند	دوستانه بودن	to be friendly	to be a friend	0.6973	1.0	0.6973	False
12687	12687	12687	12687	39937	39937	39937	2485	//	xIntent	PersonX follows PersonX's father 's ___	to be recognized	PersonX پدر ___ پدر PersonX را دنبال می کند	شناخته شود	to be recognized	to hide their intentions	0.3409	1.0	0.3409	False
