	Unnamed: 0	Unnamed: 0.1	Unnamed: 0.1.1	Unnamed: 0.1.1.1	Unnamed: 0.1.1.1.1	Unnamed: 0.1.1.1.1.1	Unnamed: 0.1.1.1.1.1.1	compare	prefix	input_text	target_text	input_text_fa	target_text_fa	pred_text1	pred_text2	preds_score	pred1_score	pred2_score	bookmark
34004	34003	34004	34003	29057	29057	29057	11606	//	xIntent	PersonX rubs PersonY's hands together	to rub hands	PersonX دست های PersonY را به هم می مالد	دست مالیدن	to rub hands	to steal	0.2516	1.0	0.2516	False
34012	34012	34012	34012	28879	28879	28879	11428	//	xIntent	PersonX rubs PersonY's temples	to be romantic	PersonX معابد PersonY را می مالد	عاشقانه بودن	to be romantic	to make money	0.1835	1.0	0.1835	False
34025	34025	34025	34025	32667	32667	32667	15216	//	xIntent	PersonX rubs shoulders	to relieve tension	PersonX شانه ها را می مالد	برای از بین بردن تنش	to relieve tension	to make money	0.0488	1.0	0.0488	False
34044	34044	34044	34044	36910	36910	36910	19459	//	xIntent	PersonX ruins PersonX's day	to be a bully	PersonX روز PersonX را خراب می کند	قلدر شدن	to be a bully	to hide their intentions	0.2829	1.0	0.2829	False
34048	34048	34048	34048	36758	36758	36758	19307	//	xIntent	PersonX ruins PersonY's day	to be mean	PersonX روز PersonY را خراب می کند	حقیر بودن	to be mean	to destroy persony	0.3361	1.0	0.3361	False
34086	34090	34088	34087	17655	17655	17655	20205	//	xIntent	PersonX runs PersonX's first marathon	to be part of a team	PersonX اولین ماراتن PersonX را اجرا می کند	بخشی از یک تیم باشد	to be part of a team	to earn money	0.15	1.0	0.15	False
34106	34105	34106	34105	30059	30059	30059	12608	=	xIntent	PersonX runs PersonY's hand through PersonY's hair	to be loving	PersonX runs PersonY's hand through PersonY's hair	عاشق بودن	to be loving	to be loving	1.0	1.0	1.0	False
34134	34134	34134	34134	8330	8330	8330	30881	//	xIntent	PersonX runs all the way	to get there quickly	PersonX تمام راه را اجرا می کند	برای رسیدن سریع به آنجا	to get there quickly	to be productive	0.3223	1.0	0.3223	False
34164	34158	34162	34160	46842	46842	46842	9390	//	xIntent	PersonX runs away from home	to get away from home	PersonX از خانه فرار می کند	برای دور شدن از خانه	to get away from home	to be alone	0.4561	1.0	0.4561	False
34174	34174	34174	34174	32820	32820	32820	15369	//	xIntent	PersonX runs counter	to shake things up	PersonX مقابله می کند	برای تکان دادن همه چیز	to shake things up	to be a good friend	0.2341	1.0	0.2341	False
34192	34192	34192	34192	11276	11276	11276	33827	//	xIntent	PersonX runs everyday	to be healthy	PersonX هر روز اجرا می شود	برای سالم بودن	to be healthy	to accomplish something	0.398	1.0	0.398	False
34196	34194	34196	34194	11097	11097	11097	33648	//	xIntent	PersonX runs everywhere	to be healthy	PersonX همه جا اجرا می شود	برای سالم بودن	to be healthy	to be productive	0.6265	1.0	0.6265	False
34198	34199	34197	34200	24274	24274	24274	26824	//	xIntent	PersonX runs fast	to get somewhere fast	PersonX سریع اجرا می شود	سریع رسیدن به جایی	to get somewhere fast	to be productive	0.3586	1.0	0.3586	False
34213	34213	34213	34213	9659	9659	9659	32210	//	xIntent	PersonX runs for office	to get elected to office	PersonX برای دفتر کار می کند	انتخاب شدن به سمت دفتر	to get elected to office	to earn money	0.3116	1.0	0.3116	False
34233	34233	34233	34233	35373	35373	35373	17922	//	xIntent	PersonX runs like hell	to escape	PersonX مانند جهنم اجرا می شود	برای فرار	to escape	to show off	0.3996	1.0	0.3996	False
34236	34236	34236	34236	31407	31407	31407	13956	//	xIntent	PersonX runs out the clock	to win	PersonX ساعت تمام می شود	برنده شدن	to win	to be taken care of	0.2316	1.0	0.2316	False
34248	34248	34248	34248	32163	32163	32163	14712	//	xIntent	PersonX runs riot	to hurt others	PersonX شورش را اجرا می کند	برای صدمه زدن به دیگران	to hurt others	to earn money	0.1952	1.0	0.1952	False
34272	34272	34272	34272	27001	27001	27001	29551	//	xIntent	PersonX runs the race	to win	PersonX مسابقه را اجرا می کند	برنده شدن	to win	to accomplish a task	0.4155	1.0	0.4155	False
34288	34288	34288	34288	9033	9033	9033	31584	//	xIntent	PersonX runs track	to compete	PersonX مسیر را اجرا می کند	مسابقه دادن	to compete	to اجرا	0.2415	1.0	0.2415	False
34301	34301	34301	34301	34874	34874	34874	17423	//	xIntent	PersonX runs water for minutes	to wash the dishes	PersonX برای چند دقیقه آب اجرا می کند	برای شستن ظروف	to wash the dishes	to accomplish something	0.288	1.0	0.288	False
34303	34303	34303	34303	31686	31686	31686	14235	//	xIntent	PersonX runs with scissors	to run off energy	PersonX با قیچی اجرا می شود	برای oEffect کردن انرژی	to run off energy	to accomplish something	0.3408	1.0	0.3408	False
34306	34308	34306	34308	31158	31158	31158	13707	//	xIntent	PersonX runs with the hare and hunt with the hounds	to explore	PersonX با خرگوش می دود و با سگ های شکاری شکار می کند	کاوش	to explore	to escape from a situation	0.4234	1.0	0.4234	False
34320	34320	34320	34320	46880	46880	46880	9428	//	xIntent	PersonX rushes ___ to the hospital	to save someone	PersonX با عجله ___ به بیمارستان منتقل می شود	برای نجات کسی	to save someone	to avoid getting medical assistance	0.3517	1.0	0.3517	False
34322	34322	34322	34322	14844	14844	14844	37395	//	xIntent	PersonX rushes ___ to the vet	to save his pet	PersonX با عجله ___ به دامپزشک می رود	حیوان خانگی خود را نجات دهد	to save his pet	to ignore someone	0.2456	1.0	0.2456	False
34326	34329	34327	34328	9457	9457	9457	32008	//	xIntent	PersonX rushes around	to get tasks done	PersonX به اطراف می شتابد	برای انجام وظایف	to get tasks done	to leave	0.225	1.0	0.225	False
34335	34334	34338	34337	12731	12731	12731	35282	//	xIntent	PersonX rushes downstairs	to get somewhere quickly	PersonX با عجله به طبقه پایین می رود	برای رسیدن سریع به جایی	to get somewhere quickly	to test the test	0.1614	1.0	0.1614	False
34342	34342	34342	34342	723	723	723	40723	//	xIntent	PersonX rushes to PersonX's car	to get somewhere quickly	PersonX با عجله به سمت ماشین PersonX می رود	برای رسیدن سریع به جایی	to get somewhere quickly	to go somewhere	0.6907	1.0	0.6907	False
34371	34371	34371	34371	23766	23766	23766	26316	=	xIntent	PersonX rushes to the store	to buy something	PersonX با عجله خود را به فروشگاه می رساند	برای خریدن چیزی	to buy something	to buy something	1.0	1.0	1.0	False
34381	34381	34381	34381	33388	33388	33388	15937	//	xIntent	PersonX rushes upon PersonY	to attack him	PersonX با سرعت روی PersonY می شتابد	تا به او حمله کند	to attack him	to leave	0.314	1.0	0.314	False
34394	34394	34394	34394	3713	3713	3713	43713	//	xIntent	PersonX safeguards PersonX's interests	to be safe	PersonX از منافع PersonX محافظت می کند	ایمن بودن	to be safe	to be a good person	0.3945	1.0	0.3945	False
34406	34406	34406	34406	34562	34562	34562	17111	//	xIntent	PersonX sails along the coast	to see the world	PersonX در امتداد ساحل حرکت می کند	برای دیدن جهان	to see the world	to get a good grade	0.1695	1.0	0.1695	False
34415	34415	34415	34415	42862	42862	42862	5410	//	xIntent	PersonX satisfies PersonX's hunger	to eat	PersonX گرسنگی PersonX را برطرف می کند	خوردن	to eat	to cause trouble	0.247	1.0	0.247	False
34435	34435	34435	34435	38173	38173	38173	721	//	xIntent	PersonX satisfies every ___	to be pleasured	PersonX هر ___ را برآورده می کند	خوشحال شدن	to be pleasured	to be a good leader	0.213	1.0	0.213	False
34522	34522	34522	34522	37936	37936	37936	484	//	xIntent	PersonX saves a ___ from death	to save someone	PersonX یک ___ را از مرگ نجات می دهد	برای نجات کسی	to save someone	to rescue someone	0.7921	1.0	0.7921	False
34542	34542	34542	34542	26060	26060	26060	28610	//	xIntent	PersonX saves for years	to buy something	PersonX سالها پس انداز می کند	برای خریدن چیزی	to buy something	to be ahead	0.2863	1.0	0.2863	False
34559	34557	34559	34557	32603	32603	32603	15152	//	xIntent	PersonX saves the day	to be a hero	PersonX روز را ذخیره می کند	قهرمان بودن	to be a hero	to be a good person	0.5417	1.0	0.5417	False
34575	34575	34575	34575	47192	47192	47192	9740	//	xIntent	PersonX saves up enough money	to buy something	PersonX به اندازه کافی پس انداز می کند	برای خریدن چیزی	to buy something	to be noticed	0.3784	1.0	0.3784	False
34585	34585	34585	34585	43259	43259	43259	5807	//	xIntent	PersonX says PersonY prayers	to be religious	PersonX دعاهای PersonY را می خواند	مذهبی بودن	to be religious	to celebrate	0.3549	1.0	0.3549	False
34592	34593	34594	34592	27824	27824	27824	10373	//	xIntent	PersonX says PersonY would	to inform	PersonX می گوید PersonY می خواهد	خبر دادن	to inform	to be a friend	0.3981	1.0	0.3981	False
34608	34608	34608	34608	26253	26253	26253	28803	//	xIntent	PersonX says a prayer	to be religious	PersonX دعایی می خواند	مذهبی بودن	to be religious	to celebrate	0.3549	1.0	0.3549	False
34637	34637	34637	34637	1686	1686	1686	41686	//	xIntent	PersonX says goodbye	to be friendly	PersonX خداحافظی می کند	دوستانه بودن	to be friendly	to be a good person	0.5547	1.0	0.5547	False
34644	34644	34644	34644	4172	4172	4172	44172	//	xIntent	PersonX says happy birthday	to celebrate	PersonX می گوید تولدت مبارک	جشن گرفتن	to celebrate	to be a good person	0.2224	1.0	0.2224	False
34647	34647	34647	34647	23376	23376	23376	25926	//	xIntent	PersonX says hello	to be friendly	PersonX سلام می کند	دوستانه بودن	to be friendly	to be a good friend	0.7239	1.0	0.7239	False
34650	34652	34651	34650	27647	27647	27647	10196	//	xIntent	PersonX says hello to PersonY	to be friendly	PersonX به PersonY سلام می گوید	دوستانه بودن	to be friendly	to be nice	0.7492	1.0	0.7492	False
34657	34656	34658	34657	31675	31675	31675	14224	//	xIntent	PersonX says it all	to be honest	PersonX همه چیز را می گوید	صادقانه بگویم	to be honest	to be a bringer of news	0.4147	1.0	0.4147	False
34660	34661	34660	34661	10801	10801	10801	33352	//	xIntent	PersonX says it was delicious	to complement	PersonX می گوید خوشمزه بود	تکمیل کردن	to complement	to explain themselves	0.4185	1.0	0.4185	False
34680	34680	34680	34680	9113	9113	9113	31664	//	xIntent	PersonX says okay	to compromise	PersonX می گوید خوب	مصالحه کردن	to compromise	to be a good friend	0.2342	1.0	0.2342	False
34686	34687	34685	34688	24065	24065	24065	26615	//	xIntent	PersonX says something	to be heard	PersonX چیزی می گوید	شنیده شدن	to be heard	to show off	0.3252	1.0	0.3252	False
34702	34702	34702	34702	40830	40830	40830	3378	//	xIntent	PersonX says the lord 's ___	to talk to god	PersonX می گوید ارباب ___	با خدا صحبت کردن	to talk to god	to be helpful	0.3826	1.0	0.3826	False
34712	34712	34712	34712	33399	33399	33399	15948	//	xIntent	PersonX says unto thee	to talk	PersonX به تو می گوید	صحبت کردن	to talk	to be a bringer of news	0.3607	1.0	0.3607	False
34720	34720	34720	34720	35665	35665	35665	18214	//	xIntent	PersonX says would find	to be helpful	PersonX می گوید	مفید بودن	to be helpful	to be a bringer of news	0.4441	1.0	0.4441	False
34736	34736	34736	34736	35241	35241	35241	17790	//	xIntent	PersonX says would wait	to be patient	PersonX می گوید صبر می کند	صبور بودن	to be patient	to be a good person	0.4669	1.0	0.4669	False
34739	34739	34739	34739	31776	31776	31776	14325	//	xIntent	PersonX scares PersonY to death	to be funny	PersonX PersonY را تا حد مرگ می ترساند	خنده دار بودن	to be funny	to save him	0.2658	1.0	0.2658	False
34756	34756	34756	34756	28304	28304	28304	10853	=	xIntent	PersonX scars the crap out of PersonY	to be mean	PersonX مزاحمت های PersonY را بیرون می آورد	حقیر بودن	to be mean	to be mean	1.0	1.0	1.0	False
34758	34758	34758	34758	29593	29593	29593	12142	//	xIntent	PersonX scars the hell out of PersonY	to be intimidating	PersonX جهنم PersonY را از بین می برد	ترساندن	to be intimidating	to get revenge	0.3319	1.0	0.3319	False
34771	34771	34771	34771	10514	10514	10514	33065	//	xIntent	PersonX schedules an interview	to get a job	PersonX مصاحبه ای را تعیین می کند	شغل گرفتن	to get a job	to maintain a good relationship	0.2484	1.0	0.2484	False
34780	34778	34779	34777	24043	24043	24043	26593	//	xIntent	PersonX scores a goal	to win	PersonX یک گل می زند	برنده شدن	to win	to settle a dispute	0.2969	1.0	0.2969	False
34782	34782	34782	34782	10616	10616	10616	33167	//	xIntent	PersonX scores a point	to win	PersonX یک امتیاز کسب می کند	برنده شدن	to win	to get a good grade	0.3215	1.0	0.3215	False
34793	34793	34793	34793	25354	25354	25354	27904	//	xIntent	PersonX scours the internet	to find information	PersonX اینترنت را جستجو می کند	برای یافتن اطلاعات	to find information	to find out what is available	0.5936	1.0	0.5936	False
34823	34823	34823	34823	32627	32627	32627	15176	//	xIntent	PersonX screams blue murder	to shout	PersonX قتل آبی را فریاد می زند	داد زدن	to shout	to settle a dispute	0.2766	1.0	0.2766	False
34825	34825	34825	34825	9079	9079	9079	31630	//	xIntent	PersonX screams for help	to get someone's attention	PersonX فریاد می زند برای کمک	جلب توجه کسی	to get someone's attention	to take responsibility	0.3067	1.0	0.3067	False
34830	34830	34830	34830	11289	11289	11289	33840	//	xIntent	PersonX screams loudly	to express anger	PersonX با صدای بلند فریاد می کشد	برای ابراز خشم	to express anger	to express emotion	0.6461	1.0	0.6461	False
34850	34848	34846	34850	26282	26282	26282	28832	//	xIntent	PersonX searches all day	to find something	PersonX تمام روز جستجو می کند	پیدا کردن چیزی	to find something	to find out what is happening	0.5222	1.0	0.5222	False
34851	34851	34851	34851	6911	6911	6911	46911	//	xIntent	PersonX searches all over the house	to find something	PersonX در کل خانه جستجو می کند	پیدا کردن چیزی	to find something	to find out what is happening	0.5222	1.0	0.5222	False
34852	34852	34852	34852	10462	10462	10462	33013	//	xIntent	PersonX searches around	to find something	PersonX در اطراف جستجو می کند	پیدا کردن چیزی	to find something	to find out what is happening	0.5222	1.0	0.5222	False
34854	34854	34854	34854	39469	39469	39469	2017	//	xIntent	PersonX searches every ___	to find something	PersonX هر ___ جستجو می کند	پیدا کردن چیزی	to find something	to find out what is happening	0.5222	1.0	0.5222	False
34857	34857	34857	34857	1660	1660	1660	41660	//	xIntent	PersonX searches everywhere	to find something	PersonX در همه جا جستجو می کند	پیدا کردن چیزی	to find something	to find out what is happening	0.5222	1.0	0.5222	False
34864	34864	34864	34864	10871	10871	10871	33422	//	xIntent	PersonX searches everywhere for it	to find it	PersonX همه جا آن را جستجو می کند	پیدا کردنش	to find it	to find out what is happening	0.4948	1.0	0.4948	False
34868	34868	34868	34868	8437	8437	8437	30988	//	xIntent	PersonX searches for hours	to find something	PersonX ساعت ها جستجو می کند	پیدا کردن چیزی	to find something	to find out what is happening	0.5222	1.0	0.5222	False
34872	34871	34872	34871	12805	12805	12805	35356	//	xIntent	PersonX searches frantically	to find something	PersonX با عصبانیت جستجو می کند	پیدا کردن چیزی	to find something	to get away from something	0.4527	1.0	0.4527	False
34880	34880	34880	34880	21071	21071	21071	23621	//	xIntent	PersonX searches the entire house	to find something	PersonX کل خانه را جستجو می کند	پیدا کردن چیزی	to find something	to find out what is happening	0.5222	1.0	0.5222	False
34901	34901	34901	34901	45632	45632	45632	8180	//	xIntent	PersonX seeks PersonX's fortune	to be successful	PersonX به دنبال شانس PersonX است	برای موفق شدن	to be successful	to earn a living	0.5275	1.0	0.5275	False
34908	34908	34908	34908	34547	34547	34547	17096	//	xIntent	PersonX seeks PersonY opportunity	to compete	PersonX به دنبال فرصت PersonY است	مسابقه دادن	to compete	to be a good friend	0.2135	1.0	0.2135	False
34943	34943	34943	34943	17412	17412	17412	39963	//	xIntent	PersonX seems like PersonY	to be like persony	به نظر می رسد PersonX مانند PersonY است	مثل شخصیتی بودن	to be like persony	to be a good friend	0.5245	1.0	0.5245	False
34956	34956	34956	34956	8073	8073	8073	30624	//	xIntent	PersonX seems to work	to make money	به نظر می رسد PersonX کار می کند	پول در آوردن	to make money	to be a good friend	0.2376	1.0	0.2376	False
34969	34969	34969	34969	36304	36304	36304	18853	//	xIntent	PersonX sees PersonX's car	to drive	PersonX ماشین PersonX را می بیند	رانندگی	to drive	to be busy	0.4619	1.0	0.4619	False
34990	34990	34990	34990	3599	3599	3599	43599	//	xIntent	PersonX sees PersonX's son	to see his child	PersonX پسر PersonX را می بیند	فرزندش را ببیند	to see his child	to be noticed	0.4112	1.0	0.4112	False
34996	34997	34995	34996	33542	33542	33542	16091	//	xIntent	PersonX sees PersonY article	to read	PersonX مقاله PersonY را می بیند	خواندن	to read	to explain something	0.4034	1.0	0.4034	False
35000	35000	35000	35000	28856	28856	28856	11405	//	xIntent	PersonX sees PersonY cry	to see cry	PersonX گریه PersonY را می بیند	برای دیدن گریه	to see cry	to be mean	0.292	1.0	0.292	False
35005	35005	35005	35005	35608	35608	35608	18157	//	xIntent	PersonX sees PersonY family	to formalize his relationship	PersonX خانواده PersonY را می بیند	رابطه اش را رسمی کند	to formalize his relationship	to be friendly	0.3597	1.0	0.3597	False
35066	35066	35066	35066	15775	15775	15775	38326	//	xIntent	PersonX sees PersonY's aunt	to visit someone	PersonX خاله PersonY را می بیند	برای دیدار با کسی	to visit someone	to be mean	0.2798	1.0	0.2798	False
35089	35089	35089	35089	46673	46673	46673	9221	//	xIntent	PersonX sees PersonY's family	to see family	PersonX خانواده PersonY را می بیند	برای دیدن خانواده	to see family	to be friendly	0.3607	1.0	0.3607	False
35096	35096	35096	35096	3146	3146	3146	43146	//	xIntent	PersonX sees PersonY's favorite band in concert	to enjoy the concert	PersonX گروه مورد علاقه PersonY را در کنسرت می بیند	برای لذت بردن از کنسرت	to enjoy the concert	to show appreciation	0.3812	1.0	0.3812	False
35180	35180	35180	35180	13872	13872	13872	36423	//	xIntent	PersonX sees ___ though	to be accomplished	PersonX ___ را می بیند	تحقق یابد	to be accomplished	to be informed	0.5245	1.0	0.5245	False
35198	35198	35198	35198	25790	25790	25790	28340	//	xIntent	PersonX sees a broadway show	to be entertained	PersonX نمایش بزرگراه را می بیند	سرگرم شدن	to be entertained	to see the show	0.4559	1.0	0.4559	False
35203	35203	35203	35203	20607	20607	20607	23157	//	xIntent	PersonX sees a comedy show	to have fun	PersonX یک نمایش کمدی می بیند	تفریح ​​کردن	to have fun	to entertain	0.6273	1.0	0.6273	False
35208	35208	35208	35208	8804	8804	8804	31355	//	xIntent	PersonX sees a concert	to hear music	PersonX یک کنسرت می بیند	برای شنیدن موسیقی	to hear music	to spend time with friends	0.2861	1.0	0.2861	False
35213	35212	35213	35212	23353	23353	23353	25903	//	xIntent	PersonX sees a doctor	to get a checkup	PersonX به پزشک مراجعه می کند	برای گرفتن چکاپ	to get a checkup	to get a good grade	0.3588	1.0	0.3588	False
35218	35218	35218	35218	19254	19254	19254	21804	//	xIntent	PersonX sees a horror movie	to be entertained	PersonX یک فیلم ترسناک می بیند	سرگرم شدن	to be entertained	to be alone	0.3862	1.0	0.3862	False
35223	35223	35223	35223	4486	4486	4486	44486	//	xIntent	PersonX sees a man about a horse	to buy a horse	PersonX مردی را در مورد اسب می بیند	خریدن اسب	to buy a horse	to hide his sadness	0.1668	1.0	0.1668	False
35227	35227	35227	35227	1663	1663	1663	41663	//	xIntent	PersonX sees a movie	to see the movie	PersonX یک فیلم می بیند	برای دیدن فیلم	to see the movie	to be entertained	0.394	1.0	0.394	False
35251	35251	35251	35251	24710	24710	24710	27260	//	xIntent	PersonX sees a therapist	to talk to someone	PersonX به یک درمانگر مراجعه می کند	با کسی صحبت کردن	to talk to someone	to be a sick person	0.3302	1.0	0.3302	False
35253	35253	35253	35253	24777	24777	24777	27327	//	xIntent	PersonX sees a wolf	to be aware	PersonX یک گرگ را می بیند	آگاه بودن	to be aware	to cause trouble	0.3333	1.0	0.3333	False
35256	35256	35256	35256	36105	36105	36105	18654	//	xIntent	PersonX sees all of PersonX's friends	to be sociable	PersonX همه دوستان PersonX را می بیند	خوش مشرب بودن	to be sociable	to be friendly	0.713	1.0	0.713	False
35261	35261	35261	35261	20037	20037	20037	22587	//	xIntent	PersonX sees an action movie	to relax	PersonX یک فیلم اکشن می بیند	آرام شدن	to relax	to be a bully	0.0625	1.0	0.0625	False
35282	35283	35284	35281	288	288	288	40288	//	xIntent	PersonX sees how the land lies	to understand	PersonX می بیند که زمین چگونه دروغ می گوید	فهمیدن	to understand	to be a romodel	0.348	1.0	0.348	False
35286	35286	35286	35286	44862	44862	44862	7410	//	xIntent	PersonX sees if could help	to be helpful	PersonX می بیند که آیا می تواند کمک کند	مفید بودن	to be helpful	to be a good person	0.5062	1.0	0.5062	False
35305	35305	35305	35305	11273	11273	11273	33824	//	xIntent	PersonX sees my friend	to hangout	PersonX دوستم را می بیند	به پاتوق	to hangout	to be friendly	0.4512	1.0	0.4512	False
35306	35307	35306	35307	35141	35141	35141	17690	//	xIntent	PersonX sees note 3	to purchase it	PersonX یادداشت 3 را مشاهده می کند	برای خرید آن	to purchase it	to appear knowledgeable	0.3032	1.0	0.3032	False
35334	35334	35334	35334	33100	33100	33100	15649	//	xIntent	PersonX sees the forest for the trees	to see the big picture	PersonX جنگل را برای درختان می بیند	برای دیدن تصویر بزرگ	to see the big picture	to have fun	0.2993	1.0	0.2993	False
35349	35349	35349	35349	4633	4633	4633	44633	//	xIntent	PersonX sees the point	to understand	PersonX این نکته را می بیند	فهمیدن	to understand	to be noticed	0.5431	1.0	0.5431	False
35351	35351	35351	35351	24763	24763	24763	27313	//	xIntent	PersonX sees the principal	to get advice	PersonX اصل را می بیند	برای گرفتن مشاوره	to get advice	to display a point	0.1934	1.0	0.1934	False
35364	35364	35364	35364	10848	10848	10848	33399	//	xIntent	PersonX sees the sunset	to see beauty	PersonX غروب خورشید را می بیند	دیدن زیبایی	to see beauty	to enjoy a tasty meal	0.2459	1.0	0.2459	False
35366	35365	35366	35365	6126	6126	6126	46126	//	xIntent	PersonX sees the tree	to study the tree	PersonX درخت را می بیند	برای مطالعه درخت	to study the tree	to find a lost pet	0.1691	1.0	0.1691	False
35380	35380	35380	35380	5727	5727	5727	45727	//	xIntent	PersonX sees what was making the noise	to know what is making the noise	PersonX می بیند چه چیزی باعث ایجاد صدا می شود	بدانید چه چیزی باعث ایجاد صدا می شود	to know what is making the noise	to be noticed	0.211	1.0	0.211	False
35420	35419	35420	35419	39616	39616	39616	2164	//	xIntent	PersonX sells PersonX's ___ at a price	to make money	PersonX ___ PersonX را با قیمتی می فروشد	پول در آوردن	to make money	to be a good worker	0.5065	1.0	0.5065	False
35422	35423	35421	35424	39172	39172	39172	1720	//	xIntent	PersonX sells PersonX's ___ at prices	to make money	PersonX ___ PersonX را با قیمت می فروشد	پول در آوردن	to make money	to be a good worker	0.5065	1.0	0.5065	False
35435	35434	35436	35435	18391	18391	18391	20941	//	xIntent	PersonX sells PersonX's collection	to make money	PersonX مجموعه PersonX را به فروش می رساند	پول در آوردن	to make money	to be noticed	0.1728	1.0	0.1728	False
35443	35443	35443	35443	15415	15415	15415	37966	//	xIntent	PersonX sells PersonX's home	to make money	PersonX خانه PersonX را می فروشد	پول در آوردن	to make money	to have a nice home	0.2821	1.0	0.2821	False
35451	35451	35451	35451	18339	18339	18339	20889	//	xIntent	PersonX sells PersonX's motorcycle	to have money	PersonX موتور سیکلت PersonX را می فروشد	داشتن پول	to have money	to get a job	0.5212	1.0	0.5212	False
