	Unnamed: 0	Unnamed: 0.1	Unnamed: 0.1.1	Unnamed: 0.1.1.1	Unnamed: 0.1.1.1.1	Unnamed: 0.1.1.1.1.1	Unnamed: 0.1.1.1.1.1.1	compare	prefix	input_text	target_text	input_text_fa	target_text_fa	pred_text1	pred_text2	preds_score	pred1_score	pred2_score	bookmark
5	5	5	5	40042	40042	40042	2590	//	xIntent	PersonX abolishes the ___ altogether	to end it	PersonX ___ را کاملاً لغو می کند	برای پایان دادن به آن	to end it	to be noticed	0.3287	1.0	0.3287	False
23	24	22	25	15607	15607	15607	38158	//	xIntent	PersonX accepts PersonY's proposal	to get married	PersonX پیشنهاد PersonY را می پذیرد	ازدواج	to get married	to encourage	0.229	1.0	0.229	False
28	28	28	28	16385	16385	16385	38936	//	xIntent	PersonX accepts ___ as PersonX's savior	to be religious	PersonX ___ را به عنوان ناجی PersonX می پذیرد	مذهبی بودن	to be religious	to be noticed	0.2756	1.0	0.2756	False
41	41	41	41	1782	1782	1782	41782	//	xIntent	PersonX accepts the challenge	to win	PersonX این چالش را می پذیرد	برنده شدن	to win	to be noticed	0.2648	1.0	0.2648	False
48	48	48	48	26903	26903	26903	29453	//	xIntent	PersonX accepts the fact	to be rational	PersonX این واقعیت را می پذیرد	منطقی بودن	to be rational	to be noticed	0.3869	1.0	0.3869	False
54	54	54	54	34264	34264	34264	16813	//	xIntent	PersonX accepts without question	to be generous	PersonX بدون سوال قبول می کند	بخشنده بودن	to be generous	to avoid a problem	0.2864	1.0	0.2864	False
70	70	70	70	44589	44589	44589	7137	=	xIntent	PersonX accomplishes PersonX's goals	to be successful	PersonX اهداف PersonX را محقق می کند	برای موفق شدن	to be successful	to be successful	1.0	1.0	1.0	False
77	77	77	77	45982	45982	45982	8530	//	xIntent	PersonX accomplishes PersonX's objectives	to be content	PersonX اهداف PersonX را محقق می کند	راضی بودن	to be content	to be successful	0.4978	1.0	0.4978	False
109	109	109	109	15109	15109	15109	37660	//	xIntent	PersonX accuses ___ of cheating	to bring justice	PersonX ___ را به تقلب متهم می کند	برای آوردن عدالت	to bring justice	to display their authority	0.344	1.0	0.344	False
112	116	112	116	36496	36496	36496	19045	=	xIntent	PersonX aces PersonX's exam	to get a good grade	PersonX aces امتحان PersonX است	برای گرفتن نمره خوب	to get a good grade	to get a good grade	1.0	1.0	1.0	False
131	131	131	131	42795	42795	42795	5343	//	xIntent	PersonX achieves PersonX's goals	to be successful	PersonX به اهداف PersonX می رسد	برای موفق شدن	to be successful	to be ahead	0.6442	1.0	0.6442	False
139	138	137	139	42640	42640	42640	5188	//	xIntent	PersonX achieves PersonX's potential	to be successful	PersonX به پتانسیل PersonX دست می یابد	برای موفق شدن	to be successful	to be ahead	0.6442	1.0	0.6442	False
142	142	142	142	35348	35348	35348	17897	//	xIntent	PersonX achieves PersonY end	to be alone	PersonX به پایان PersonY می رسد	تنها بودن	to be alone	to chase them	0.1969	1.0	0.1969	False
154	154	154	154	39437	39437	39437	1985	//	xIntent	PersonX achieves the organization 's ___	to be a good worker	PersonX به سازمان ___ دست می یابد	کارگر خوب بودن	to be a good worker	to be responsible	0.474	1.0	0.474	False
165	165	165	165	34503	34503	34503	17052	//	xIntent	PersonX acquires PersonY knowledge	to be smarter	PersonX دانش PersonY را کسب می کند	باهوش تر بودن	to be smarter	to be a good friend	0.3376	1.0	0.3376	False
168	169	168	169	31680	31680	31680	14229	//	xIntent	PersonX acts PersonX's age	to be seen as mature	PersonX سن PersonX را اعمال می کند	بالغ دیده شود	to be seen as mature	to obey the rules	0.3065	1.0	0.3065	False
171	171	171	171	45323	45323	45323	7871	//	xIntent	PersonX acts as PersonY agent	to make money	PersonX به عنوان نماینده PersonY عمل می کند	پول در آوردن	to make money	to be نمایe	0.1435	1.0	0.1435	False
193	193	193	193	34703	34703	34703	17252	//	xIntent	PersonX acts like men	to be seen as masculine	PersonX مانند مردان عمل می کند	مردانه دیده شود	to be seen as masculine	to be a good person	0.3841	1.0	0.3841	False
210	210	210	210	43190	43190	43190	5738	//	xIntent	PersonX adapts to PersonX's environment	to be comfortable	PersonX با محیط PersonX سازگار می شود	راحت بودن	to be comfortable	to be productive	0.3988	1.0	0.3988	False
212	212	212	212	41202	41202	41202	3750	//	xIntent	PersonX addresses the ___ directly	to be direct	PersonX مستقیماً به ___ آدرس می دهد	مستقیم بودن	to be direct	to obey the rules	0.3785	1.0	0.3785	False
223	223	223	223	44004	44004	44004	6552	//	xIntent	PersonX adds ___ to injury	to add more problems	PersonX ___ را به آسیب وارد می کند	برای اضافه کردن مشکلات بیشتر	to add more problems	to be a good worker	0.1735	1.0	0.1735	False
228	227	228	227	37752	37752	37752	300	//	xIntent	PersonX adds ___ to the flame	to create problems	PersonX ___ را به شعله اضافه می کند	برای ایجاد مشکل	to create problems	to be noticed	0.3608	1.0	0.3608	False
248	248	248	248	31865	31865	31865	14414	//	xIntent	PersonX adds oil	to mix	PersonX روغن اضافه می کند	درآمیختن	to mix	to maintain health	0.2092	1.0	0.2092	False
264	264	264	264	41584	41584	41584	4132	//	xIntent	PersonX adjusts PersonX's ___ accordingly	to behave correctly	PersonX ___ PersonX را بر این اساس تنظیم می کند	درست رفتار کردن	to behave correctly	to be a leader	0.3257	1.0	0.3257	False
267	267	267	267	30081	30081	30081	12630	=	xIntent	PersonX adjusts PersonY's glasses	to see better	PersonX adjusts PersonY's glasses	to see better	to see better	to see better	1.0	1.0	1.0	False
277	277	277	277	22531	22531	22531	25081	//	xIntent	PersonX admits PersonY was wrong	to be truthful	PersonX اعتراف می کند PersonY اشتباه بوده است	راستگو بودن	to be truthful	to argue	0.4261	1.0	0.4261	False
289	289	289	289	34962	34962	34962	17511	//	xIntent	PersonX adopts PersonY policy	to be successful	PersonX سیاست PersonY را در پیش می گیرد	برای موفق شدن	to be successful	to promote a cause	0.4552	1.0	0.4552	False
304	301	302	299	9383	9383	9383	31934	//	xIntent	PersonX adopts a child	to be a parent	PersonX کودکی را به فرزندی قبول می کند	پدر و مادر بودن	to be a parent	to congratulate her son.	0.3182	1.0	0.3182	False
312	313	314	312	22190	22190	22190	24740	//	xIntent	PersonX adopts a little girl	to be a parent	PersonX یک دختر کوچک را به فرزندی قبول می کند	پدر و مادر بودن	to be a parent	to congratulate her on his responsibility	0.1072	1.0	0.1072	False
319	319	319	319	24852	24852	24852	27402	//	xIntent	PersonX adopts a pet	to have a companion	PersonX یک حیوان خانگی را به فرزندی قبول می کند	همراه داشتن	to have a companion	to congratulate her son.	0.1688	1.0	0.1688	False
352	355	354	353	4780	4780	4780	44780	//	xIntent	PersonX advances toward PersonY	to fight	PersonX به سمت PersonY پیش می رود	جنگیدن	to fight	to reach a destination	0.2636	1.0	0.2636	False
367	365	367	365	35199	35199	35199	17748	//	xIntent	PersonX advises PersonY to take	to be helpful	PersonX به PersonY توصیه می کند که استفاده کند	مفید بودن	to be helpful	to be a good friend	0.5338	1.0	0.5338	False
405	405	405	405	25413	25413	25413	27963	//	xIntent	PersonX affords anything	to spend money	PersonX استطاعت هر چیزی را دارد	به صرف پول	to spend money	to be a part of the community	0.2618	1.0	0.2618	False
414	414	414	414	25226	25226	25226	27776	//	xIntent	PersonX affords to fix it	to save money	PersonX توانایی رفع آن را دارد	برای صرفه جویی در پول	to save money	to be productive	0.4538	1.0	0.4538	False
427	430	428	429	20413	20413	20413	22963	//	xIntent	PersonX agrees to go with PersonY	to hang out	PersonX موافقت می کند که با PersonY همراه شود	پاتوق کردن	to hang out	to be a part of the group	0.4095	1.0	0.4095	False
435	435	435	435	6073	6073	6073	46073	//	xIntent	PersonX agrees to the date	to go out	PersonX با تاریخ موافقت می کند	بیرون رفتن	to go out	to be known	0.3412	1.0	0.3412	False
440	438	441	439	26437	26437	26437	28987	//	xIntent	PersonX agrees to try it	to be adventurous	PersonX موافقت می کند که آن را امتحان کند	پرماجرا بودن	to be adventurous	to do something good	0.4934	1.0	0.4934	False
452	452	452	452	37541	37541	37541	89	//	xIntent	PersonX allocates ___ efficiently	to be efficient	PersonX ___ را به طور کارآمد اختصاص می دهد	کارآمد بودن	to be efficient	to earn money	0.4385	1.0	0.4385	False
455	455	455	455	33378	33378	33378	15927	//	xIntent	PersonX allows PersonY access	to be helpful	PersonX اجازه دسترسی به PersonY را می دهد	مفید بودن	to be helpful	to be a responsible person	0.4234	1.0	0.4234	False
459	461	459	461	21763	21763	21763	24313	//	xIntent	PersonX allows PersonY to keep the dog	to be kind	PersonX به PersonY اجازه می دهد تا سگ را نگه دارد	مهربان بودن	to be kind	to avoid a bad situation	0.3513	1.0	0.3513	False
465	465	465	465	26802	26802	26802	29352	//	xIntent	PersonX allows pets	to be kind	PersonX به حیوانات خانگی اجازه می دهد	مهربان بودن	to be kind	to take care of themselves	0.3192	1.0	0.3192	False
470	470	470	470	20247	20247	20247	22797	//	xIntent	PersonX almost hit PersonY	to hurt persony	PersonX تقریباً به PersonY برخورد کرد	صدمه زدن به شخصیتی	to hurt persony	to be helpful	0.4185	1.0	0.4185	False
473	474	475	473	27198	27198	27198	29748	//	xIntent	PersonX almost ran	to get away	PersonX تقریباً دوید	دور شدن	to get away	to be a punctual person	0.181	1.0	0.181	False
476	476	476	476	9431	9431	9431	31982	//	xIntent	PersonX also asked	to know something	PersonX هم پرسید	چیزی دانستن	to know something	to get a answer	0.4644	1.0	0.4644	False
483	483	483	483	14610	14610	14610	37161	//	xIntent	PersonX also asked ___	to know something	PersonX همچنین از ___	چیزی دانستن	to know something	to be productive	0.2872	1.0	0.2872	False
501	501	501	501	6841	6841	6841	46841	//	xIntent	PersonX also gave	to be helpful	PersonX هم داد	مفید بودن	to be helpful	to obey the judicial powers	0.2971	1.0	0.2971	False
511	511	511	511	23641	23641	23641	26191	//	xIntent	PersonX also got	to acquire something	PersonX نیز گرفت	به دست آوردن چیزی	to acquire something	to accomplish something	0.5634	1.0	0.5634	False
518	518	518	518	6140	6140	6140	46140	//	xIntent	PersonX also kept	to save it	PersonX نیز نگه داشته است	تا آن را نجات دهد	to save it	to be cautious	0.3542	1.0	0.3542	False
526	526	526	526	7310	7310	7310	47310	//	xIntent	PersonX also played ___	to entertain himself/herself	PersonX همچنین ___ بازی کرد	خودش را سرگرم کند	to entertain himself/herself	to play	0.4234	1.0	0.4234	False
535	535	535	535	25437	25437	25437	27987	//	xIntent	PersonX also set	to mount	PersonX نیز تنظیم شده است	سوار شدن	to mount	to be a leader	0.1503	1.0	0.1503	False
548	548	548	548	30251	30251	30251	12800	=	xIntent	PersonX also took PersonY	to be helpful	PersonX also took PersonY	مفید بودن	to be helpful	to be helpful	1.0	1.0	1.0	False
552	552	552	552	6546	6546	6546	46546	//	xIntent	PersonX also tried	to get jackpot	PersonX نیز تلاش کرد	جکپات گرفتن	to get jackpot	to do something	0.4234	1.0	0.4234	False
555	555	555	555	2788	2788	2788	42788	//	xIntent	PersonX also wanted ___	to have it	PersonX همچنین می خواست ___	داشتن آن	to have it	to do something	0.6268	1.0	0.6268	False
570	570	570	570	14098	14098	14098	36649	//	xIntent	PersonX always beats ___	to win	PersonX همیشه ___ را می زند	برنده شدن	to win	to be alone	0.1993	1.0	0.1993	False
579	577	578	579	14770	14770	14770	37321	//	xIntent	PersonX always brought ___	to be prepared	PersonX همیشه ___ را آورده است	آماده شدن	to be prepared	to appear knowledgeable	0.4718	1.0	0.4718	False
585	585	585	585	2591	2591	2591	42591	//	xIntent	PersonX always drank	to feel numb	PersonX همیشه نوشید	بی حس شدن	to feel numb	to avoid a mistake	0.0569	1.0	0.0569	False
603	601	603	601	2525	2525	2525	42525	//	xIntent	PersonX always gave	to be generous	PersonX همیشه می داد	بخشنده بودن	to be generous	to obey the rules	0.3144	1.0	0.3144	False
639	637	641	639	26240	26240	26240	28790	//	xIntent	PersonX always refused	to be alone	PersonX همیشه امتناع می کرد	تنها بودن	to be alone	to be proud	0.3688	1.0	0.3688	False
643	642	644	643	26052	26052	26052	28602	//	xIntent	PersonX always slept	to be rested	PersonX همیشه می خوابید	استراحت كردن	to be rested	to be alone	0.4769	1.0	0.4769	False
655	655	655	655	4229	4229	4229	44229	//	xIntent	PersonX always told PersonY	to be honest	PersonX همیشه به PersonY می گفت	صادقانه بگویم	to be honest	to be friendly	0.4485	1.0	0.4485	False
676	676	676	676	13573	13573	13573	36124	//	xIntent	PersonX always used ___	to reduce the self effect	PersonX همیشه از ___ استفاده می کرد	برای کاهش اثر خود	to reduce the self effect	to aggregate knowledge to their audience	0.1903	1.0	0.1903	False
697	697	697	697	2960	2960	2960	42960	//	xIntent	PersonX always watched ___	to be informed	PersonX همیشه ___ را تماشا می کرد	مطلع شدن	to be informed	to show off skills	0.2952	1.0	0.2952	False
705	706	704	707	14076	14076	14076	36627	//	xIntent	PersonX always wears ___	to wear their favorite thing	PersonX همیشه ___ می پوشد	لباس مورد علاقه خود را بپوشند	to wear their favorite thing	to be brave	0.2684	1.0	0.2684	False
709	709	709	709	1755	1755	1755	41755	//	xIntent	PersonX always went	to go to the beach	PersonX همیشه می رفت	برای رفتن به ساحل	to go to the beach	to leave	0.422	1.0	0.422	False
718	718	718	718	37641	37641	37641	189	//	xIntent	PersonX analyzes the ___ in terms	to check the authenticity of the sentence	PersonX ___ را از نظر تجزیه و تحلیل می کند	برای بررسی اصالت جمله	to check the authenticity of the sentence	to be accurate	0.4946	1.0	0.4946	False
719	719	719	719	41407	41407	41407	3955	//	xIntent	PersonX animates every ___	to make a movie	PersonX هر ___ را متحرک می کند	برای ساختن فیلم	to make a movie	to make sure they are okay	0.2316	1.0	0.2316	False
725	723	725	723	45337	45337	45337	7885	//	xIntent	PersonX announces PersonY's arrival	to warn others	PersonX ورود PersonY را اعلام می کند	برای هشدار دادن به دیگران	to warn others	to inform	0.5613	1.0	0.5613	False
730	730	730	730	6827	6827	6827	46827	//	xIntent	PersonX announces the winner	to declare the champion	PersonX برنده را اعلام می کند	برای اعلام قهرمان	to declare the champion	to inform	0.2765	1.0	0.2765	False
750	750	750	750	29461	29461	29461	12010	//	xIntent	PersonX answers PersonY's phone	to know who is calling	PersonX به تلفن PersonY پاسخ می دهد	بدانم چه کسی تماس می گیرد	to know who is calling	to help person y	0.1719	1.0	0.1719	False
762	762	762	762	16942	16942	16942	39493	//	xIntent	PersonX answers every ___	to be honest	PersonX هر ___ پاسخ می دهد	صادقانه بگویم	to be honest	to be helpful	0.4773	1.0	0.4773	False
765	765	765	765	11075	11075	11075	33626	=	xIntent	PersonX answers questions	to be helpful	PersonX به س questionsالات پاسخ می دهد	مفید بودن	to be helpful	to be helpful	1.0	1.0	1.0	False
780	780	780	780	23824	23824	23824	26374	//	xIntent	PersonX answers the phone	to answer the phone	PersonX پاسخ تلفن را می دهد	برای پاسخ به تلفن	to answer the phone	to get a answer	0.4254	1.0	0.4254	False
795	795	795	795	23538	23538	23538	26088	//	xIntent	PersonX apologizes profusely	to make ammends	PersonX عذرخواهی فراوان می کند	اصلاحات	to make ammends	to be a good person	0.2036	1.0	0.2036	False
812	812	812	812	38489	38489	38489	1037	//	xIntent	PersonX applies ___ to situations	to understand	PersonX ___ را در شرایط اعمال می کند	فهمیدن	to understand	to obey the rules	0.5682	1.0	0.5682	False
816	816	816	816	38961	38961	38961	1509	//	xIntent	PersonX applies ___ to the study	to study	PersonX ___ را برای مطالعه اعمال می کند	مطالعه کردن	to study	to earn money	0.3167	1.0	0.3167	False
826	828	826	828	20032	20032	20032	22582	//	xIntent	PersonX applies for a new job	to make money	PersonX برای کار جدیدی اقدام می کند	پول در آوردن	to make money	to earn money	0.8908	1.0	0.8908	False
834	834	834	834	20926	20926	20926	23476	//	xIntent	PersonX applies for food stamps	to buy food	PersonX درخواست تمبر غذا می کند	برای خرید غذا	to buy food	to eat	0.72	1.0	0.72	False
847	847	847	847	25688	25688	25688	28238	//	xIntent	PersonX applies lotion	to be soothed	PersonX لوسیون استفاده می کند	آرام شدن	to be soothed	to earn money	-0.0065	1.0	-0.0065	False
849	849	849	849	31572	31572	31572	14121	//	xIntent	PersonX applies oneself	to be productive	PersonX خودش را اعمال می کند	مولد بودن	to be productive	to obey the rules	0.3468	1.0	0.3468	False
850	850	850	850	40690	40690	40690	3238	//	xIntent	PersonX applies the ___ to cases	to rule fairly	PersonX ___ را در موارد اعمال می کند	منصفانه حکومت کن	to rule fairly	to make a good impression	0.2374	1.0	0.2374	False
867	865	869	867	19952	19952	19952	22502	=	xIntent	PersonX applies to many jobs	to make money	PersonX در بسیاری از مشاغل اعمال می شود	پول در آوردن	to make money	to make money	1.0	1.0	1.0	False
875	876	875	876	40597	40597	40597	3145	//	xIntent	PersonX appreciates fully the ___	to be loved	PersonX کاملاً از ___ قدردانی می کند	دوست داشته شدن	to be loved	to be known as smart	0.1565	1.0	0.1565	False
878	878	878	878	2573	2573	2573	42573	//	xIntent	PersonX appreciates the gesture	to be thankful	PersonX از این حرکت قدردانی می کند	سپاسگزار بودن	to be thankful	to be proud	0.6407	1.0	0.6407	False
899	898	899	898	313	313	313	40313	//	xIntent	PersonX arms to the teeth	to be feared	بازوهای PersonX تا دندانها	ترسیدن	to be feared	to eat	0.1915	1.0	0.1915	False
904	904	904	904	44448	44448	44448	6996	//	xIntent	PersonX arouses PersonY's interest	to be intriguing	PersonX علاقه PersonY را برمی انگیزد	جذاب بودن	to be intriguing	to be a friend	0.3049	1.0	0.3049	False
922	922	922	922	37686	37686	37686	234	//	xIntent	PersonX arrives every ___	to be regular	PersonX هر ___ می رسد	منظم بودن	to be regular	to be safe	0.285	1.0	0.285	False
925	926	925	926	27354	27354	27354	29904	//	xIntent	PersonX arrives in class	to learn	PersonX به کلاس می رسد	برای یادگیری	to learn	to graduate	0.547	1.0	0.547	False
929	929	929	929	7894	7894	7894	30445	//	xIntent	PersonX arrives in time	to be punctual	PersonX به موقع می رسد	وقت شناس بودن	to be punctual	to be a cautious person	0.4094	1.0	0.4094	False
939	937	941	939	12758	12758	12758	35309	//	xIntent	PersonX arrives quickly	to get there quickly	PersonX به سرعت می رسد	برای رسیدن سریع به آنجا	to get there quickly	to be noticed	0.333	1.0	0.333	False
942	942	942	942	9287	9287	9287	31838	//	xIntent	PersonX arrives safely	to be safe	PersonX با خیال راحت می رسد	ایمن بودن	to be safe	to be a good friend	0.2721	1.0	0.2721	False
955	955	955	955	26332	26332	26332	28882	//	xIntent	PersonX arrives to school	to learn	PersonX به مدرسه می رسد	برای یادگیری	to learn	to obey the parents	0.3835	1.0	0.3835	False
972	970	973	972	5178	5178	5178	45178	//	xIntent	PersonX asks PersonX's family	to know something	PersonX از خانواده PersonX می پرسد	چیزی دانستن	to know something	to get a conversation	0.4272	1.0	0.4272	False
990	990	990	990	35923	35923	35923	18472	//	xIntent	PersonX asks PersonX's girlfriend	to find out something	PersonX از دوست دختر PersonX می پرسد	برای پیدا کردن چیزی	to find out something	to get a conversation	0.4309	1.0	0.4309	False
1052	1052	1052	1052	4974	4974	4974	44974	//	xIntent	PersonX asks PersonY if had seen	to know something	PersonX از PersonY می پرسد که آیا دیده شده است؟	چیزی دانستن	to know something	to be noticed	0.5212	1.0	0.5212	False
1075	1075	1075	1075	30144	30144	30144	12693	=	xIntent	PersonX asks PersonY questions	to know more	PersonX asks PersonY questions	برای دانستن بیشتر	to know more	to know more	1.0	1.0	1.0	False
1079	1079	1079	1079	44941	44941	44941	7489	//	xIntent	PersonX asks PersonY some questions	to get answers	PersonX از PersonY چند س asksال می پرسد	برای گرفتن پاسخ	to get answers	to get a conversation	0.4496	1.0	0.4496	False
1094	1096	1094	1096	35057	35057	35057	17606	//	xIntent	PersonX asks PersonY to accompany	to be friendly	PersonX از PersonY می خواهد همراهی کند	دوستانه بودن	to be friendly	to be a part of the community	0.4747	1.0	0.4747	False
1107	1107	1107	1107	30756	30756	30756	13305	//	xIntent	PersonX asks PersonY to dance	to dance	PersonX از PersonY می خواهد که برقصد	رقصیدن	to dance	to be responsible	0.2171	1.0	0.2171	False
1138	1138	1138	1138	3545	3545	3545	43545	//	xIntent	PersonX asks PersonY to let	to be allowed	PersonX از PersonY می خواهد که اجازه دهد	برای اینکه اجازه داده بشه	to be allowed	to be a good friend	0.2416	1.0	0.2416	False
1162	1162	1162	1162	33787	33787	33787	16336	=	xIntent	PersonX asks PersonY to return	to be nice	PersonX از PersonY می خواهد که برگردد	خوب بودن	to be nice	to be nice	1.0	1.0	1.0	False
1200	1200	1200	1200	30554	30554	30554	13103	//	xIntent	PersonX asks PersonY what happened	to know what happened	PersonX از PersonY می پرسد چه اتفاقی افتاده است	تا بداند چه اتفاقی افتاده است	to know what happened	to be helpful	0.2485	1.0	0.2485	False
1229	1229	1229	1229	43251	43251	43251	5799	//	xIntent	PersonX asks PersonY's forgiveness	to be forgiven	PersonX از PersonY بخشش می خواهد	بخشیده شدن	to be forgiven	to share	0.2813	1.0	0.2813	False
1241	1242	1241	1242	46983	46983	46983	9531	//	xIntent	PersonX asks PersonY's friends	to know something	PersonX از دوستان PersonY س asksال می کند	چیزی دانستن	to know something	to get a date	0.3047	1.0	0.3047	False
1244	1246	1244	1246	16079	16079	16079	38630	//	xIntent	PersonX asks PersonY's friends for advice	to get advice	PersonX از دوستان PersonY درخواست مشاوره می کند	برای گرفتن مشاوره	to get advice	to help out	0.6818	1.0	0.6818	False
1253	1253	1253	1253	36190	36190	36190	18739	//	xIntent	PersonX asks PersonY's girlfriend	to know something	PersonX از دوست دختر PersonY می پرسد	چیزی دانستن	to know something	to get a conversation	0.4272	1.0	0.4272	False
1287	1287	1287	1287	16746	16746	16746	39297	//	xIntent	PersonX asks PersonY's pardon	to stop feeling guilty	PersonX از بخشش PersonY س asksال می کند	احساس گناه	to stop feeling guilty	to share a tale	0.2843	1.0	0.2843	False
1294	1294	1294	1294	42433	42433	42433	4981	//	xIntent	PersonX asks PersonY's permission	to be polite	PersonX از PersonY اجازه می خواهد	مودب بودن	to be polite	to be a good friend	0.4727	1.0	0.4727	False
1303	1303	1303	1303	15753	15753	15753	38304	//	xIntent	PersonX asks PersonY's wife	to know something	PersonX از همسر PersonY س asksال می کند	چیزی دانستن	to know something	to get a date	0.3047	1.0	0.3047	False
1320	1320	1320	1320	13942	13942	13942	36493	//	xIntent	PersonX asks ___ for a ride	to go somewhere	PersonX از ___ سواری می خواهد	رفتن به جایی	to go somewhere	to be alone	0.4754	1.0	0.4754	False
1330	1328	1331	1329	13664	13664	13664	36215	//	xIntent	PersonX asks ___ for directions	to get to the destination	PersonX از ___ راهنمایی می خواهد	برای رسیدن به مقصد	to get to the destination	to be helpful	0.3466	1.0	0.3466	False
1339	1338	1340	1339	12970	12970	12970	35521	//	xIntent	PersonX asks ___ for permission	to be polite	PersonX از ___ اجازه می خواهد	مودب بودن	to be polite	to be a good friend	0.4727	1.0	0.4727	False
1378	1379	1378	1379	15205	15205	15205	37756	//	xIntent	PersonX asks ___ what the problem was	to help	PersonX از ___ می پرسد مشکل از چه قرار بوده است	برای کمک به	to help	to be a problem	0.5282	1.0	0.5282	False
1405	1405	1405	1405	24666	24666	24666	27216	//	xIntent	PersonX asks everyone	to know something	PersonX از همه س asksال می کند	چیزی دانستن	to know something	to get a date	0.3047	1.0	0.3047	False
